Original(Korean),Basic Translation(google trans),comp1 score,comp2 score,comp3 score
힘이 있다는 게 무슨 얘기니?,What exist you talk about sustain index,0.603383,0.603383,0.722383
그냥... 애들이 함부로 하지는 못했어요... 다른 애들이 함부로 할 만큼 약하지 않았어요...,I just now the Thomas Kyd werent careless they werent weak plenty to urinate other nestling careless,0.620725,0.635815,0.740606
기태한테 그런 면이 있었다는 게...,That Gitae possess that look,0.574296,0.717719,0.813528
...,,1.000000,1.000000,1.000000
솔직히 조금 생소하다. 기태가 보통 집에서는 말이 많거나 하지는 않거든... 그래서 그런지 너가 지금 하는 얘기들이 낯설게 느껴져. 난 도리어 기태가 학교에서 애들 사이하고 잘 지내는지 많이 걱정했었거든. 집에 있을 때 기태가 자기 친구들을 데리고 오는 경우도 본적이 없고...,frankly it make up a second unfamiliar Gitae commonly doesnt public lecture or public lecture at habitation and then lots so I sense strange about what youre tattle about right nowadays I exist genuinely worried that Gitae cost stimulate along with the nestling at school I take never go out Gitae contribute her ally while at dwelling,0.537877,0.640062,0.825624
저도 가본 적은 없긴 한데... 그냥 불편했던 거 같아요. 친구들이 자기 집에 오는 게... 근데 기태가 저희 집이나 동윤이 집에서는 같이 많이 놀았거든요...,I havent exist there but I cogitate it constitute just uncomfortable acquaintance get along to their theater But Gitae fiddle in my family or Dongyuns theater a circumstances,0.539442,0.624496,0.795912
그랬었구나...,You get along,0.576483,0.664760,0.756680
저도 부모님하고 있을 때 모습하고 친구들 하고 있을 때 모습이 틀려요. 기태뿐만 아니라 아마 다 그럴 거예요.,When Im with my parent when Im with my acquaintance when Im with my booster I depend incorrect Not scarcely the nonpayment but likely all,0.637293,0.563092,0.753531
그럼 기태가 학교에서 전혀 문제는 없었던 거니?,indeed get along Kitae never stimulate any job at school,0.597105,0.705037,0.797215
예... 제가 전학가기 전까지는 그럴만한 일은 전혀 없었어요..,Yes There constitute zilch like that until I exist transmit,0.553523,0.652803,0.790560
기태 일이 있기 몇 주 전에 전학 갔잖아...,You live shift a few weeks before anything encounter,0.581879,0.576738,0.722578
예.,Yes,0.701027,0.952860,0.693569
방학도 얼마 안남은 상황에서 급하게 이사 갔잖아...,You incite in a precipitation with your vacation in short,0.626927,0.613058,0.772853
그냥 집안 사정 때문에 이쪽으로 오게 된 거에요. 저는 재호가 아버님께 왜 저한테 가보라고 한 건지 잘 이해가 안가요... 기태 일이 있기 거의 몇 주 전에 전학 간 거여서 전혀 아는 게 없었거든요...,I just now come in hither because of my house luck I dont understand why Jaeho ask my Father-God to give out to me Because I live shift near a few weeks ago I didnt know anything at all,0.566413,0.621541,0.793056
그럼 기태랑은 전학 간 뒤로는 아예 본적은 없는 거고?,and so havent you learn Ki Taerang since you change,0.566428,0.642468,0.803592
전학가고 며칠 뒤에 제가 사는 아파트 단지 입구에서 기태가 저를 기다리고 있었어요. 그때 잠깐 인사하고는 그 뒤로 본적은 없어요.,A few Clarence Day after my conveyance Gitae equal expect for me at the entree of my flat composite I sound out hello for a bit and I havent take care it since,0.571038,0.611769,0.748786
그때 뭔가 이상한 점 없었고?,Was there anything strange at that clock time,0.655997,0.680651,0.763454
그냥... 이런 저런 얘기를 했는데. 별로 달라보이지는 않았어요. 그냥 짧게 얘기 했어요. 제가 전학 가니까. 작별 인사 하려고 온 거 같았어요. 평소하고 같았어요.,I just I enunciate something like this It didnt calculate rattling unlike I just pronounce it briefly Im channel It look to constitute read goodbye It constitute the similar as usual,0.583079,0.654321,0.808950
...,,1.000000,1.000000,1.000000
재호 말로는 기태가 성적에 부담을 느꼈다고 하는 거 같던데...,In Jaehos Good Book it look that Gitae experience burden with his gradation,0.558474,0.601216,0.795772
재호가요?,Jaeho,0.657107,0.528795,0.803834
응.,Huh,0.539445,0.539445,0.476177
"솔직히... 그건 아닌 거 같아요. 그런 걸로 부담 느낄 애는 아니었어요, 저도 기태가 왜 그런 선택을 했는지 정말 이해가 안갔어요. 그래서 장례식 때 애들한테 물어보기도 했는데 그냥 어느 날 갑자기 학교를 안 나왔다고만 하더라고요. 분명 기태한테 말 못 할 만큼 큰일이 있었을 거라 생각이 들어요. 충동적으로 그런 선택을 할 애는 아니거든요.",frankly I dont guess indeed I wasnt a minor who would sense weight down with that and I rattling didnt understand why Gitae make believe that selection and then at the funeral I necessitate the nestling but they scarce pronounce that they didnt get to school day one Clarence Day I recollect there must birth been something big plenty that I couldnt narrate Gitae Im not impulsively hit that alternative,0.563437,0.663402,0.819473
사진 속에 있던 다른 친구는...,The other friend in the delineation,0.565897,0.686245,0.756858
예...,Yes,0.701027,0.952860,0.693569
동윤인가?,constitute it Dongyun,0.595024,0.645559,0.749315
예..,Yes,0.701027,0.952860,0.693569
그 친구도 장례식 때 있었고?,WA he besides at the funeral,0.550905,0.597282,0.771805
아니요.,no,0.179473,0.633509,0.755402
친했다며...,I represent close,0.564794,0.646746,0.754322
"예... 그날도 안 왔고, 잘 모르겠어요... 연락이 안돼요...",Yes I didnt come that solar day Im not certain I tilt liaison you,0.657753,0.640763,0.758565
좀 얘기 해 줄 수 있니? 그 친구에 대해서...,Can you say me a flake About that supporter,0.598056,0.654570,0.812930
"동윤이는... 기태하고 동윤이는 중학교 때부터 친구였고, 저 같은 경우는 고등학교 와서 기태하고 같은 반 되면서 친해졌어요...",Dongyun make up Taetae and Dongyoon take in exist protagonist since middle schoolhouse,0.472579,0.642726,0.869818
동윤이라는 친구도 같은 반이었고...?,Dongyuns protagonist make up in the like social class,0.594483,0.657595,0.770224
"아니오... 그 친구는 이과라서 같은 반이었던 적은 한 번도 없어요. 그냥 기태 소개로 동윤이 하고도 친해졌고, 그러면서 셋이 같이 놀게 됐어요. 그렇게 셋이 친해졌지만, 동윤이하고 기태 사이는 특별했어요.",No He a skill stratum thusly hes never constitute in the like class I only turn familiar with Dongyun through the launching of Gitae and the three of them dally together The three get close but Dongyun and gilbert Tae exist special,0.584978,0.678519,0.793787
특별하다니?,constitute it special,0.640279,0.755888,0.700855
다른 애들과는 틀렸어요. 기태한테 동윤이는... 저같은 경우는 고등학교 친구고... 그래서 저는 정말 친했어도 한편으로는 벽이 있었어요...,It cost incorrect with the other nestling Dongi Dong for Kitae In my guinea pig Im a high-pitched schooling friend and so still though I comprise genuinely close there make up a bulwark on the other manus,0.555978,0.637672,0.787413
...,,1.000000,1.000000,1.000000
"하지만, 동윤이는 기태하고 유일하게 대등하게 얘기할 수 있는 사이였어요.",However Dongyun constitute in a body politic of exclusion and the only single who could verbalize evenly,0.622577,0.661095,0.775623
...,,1.000000,1.000000,1.000000
기태한테 동윤이는 저나 다른 애들과는 틀렸어요... 동윤이라면 알고 있을 거에요. 동윤이라면 아버님이 원하는 이야기를 해 줄 수 있을 거예요.,To Dongtae Dongyoon cost incorrect with me or the other shaver You lie with Dongyoon If you represent Dongyun you can say me what your beginner require,0.532565,0.630742,0.815516
...,,1.000000,1.000000,1.000000
"미친 새끼, 지네 집에서 휴지 달라고 핸드폰으로 전화를 하냐?",Crazy bastard make up you address on your cellular phone sound to necessitate for a tissue paper at your house,0.603149,0.602751,0.735324
"조용히 해, 밖에 애들 있잖아!",beryllium quiet there make up kids outside,0.646212,0.618867,0.769594
"알았으니까, 빨리 닦고 나와! 냄새 존나 나.",Okay pass over it out chop-chop It smell out sorry,0.535769,0.609095,0.775461
"아, 재미없다.",Oh its not fun,0.550303,0.613377,0.721960
마실래?,Would you like to drink in,0.398128,0.624211,0.866989
됐어. 근데 부모님 언제 오시냐?,dress But when embody your parent come in,0.666615,0.607292,0.735067
내일이나 오겠지.,It will exist tomorrow,0.649817,0.641956,0.779012
그럼 오늘 너네 집에서 잔다. 어?,and so I sleep at your family today uh,0.652850,0.703226,0.763599
...,,1.000000,1.000000,1.000000
"대답이 없냐? 야, 뭔 일 있어? 왜 말을 안해, 새끼야?",No solvent Hey whats die on Why dont you tattle bastard,0.563557,0.583138,0.755999
알았어...,Okay,0.486628,0.682943,0.729526
가서 보경이하고 얘기도 좀하고 그래.,Lets break down and tattle to Bokyung,0.650040,0.648241,0.785624
...,,1.000000,1.000000,1.000000
"또 말이 없네? 아, 새끼 진짜.",naught else Buckeye State really,0.678402,0.678402,0.763465
... 방안에서 무슨 얘기 나눈 거야?,What personify you babble about in the elbow room,0.566408,0.559168,0.760291
응? 뭔 소리야?,Huh What cost you talking about,0.431770,0.567878,0.787778
아까 보경이하고 방안에서 얘기하던데...,I constitute babble out with Bokyung in the elbow room,0.585333,0.568647,0.734714
봤어?,proverb,0.689287,0.608625,0.740365
봤으니까 묻지...,I project it and postulate,0.596882,0.641130,0.755956
"아, 그냥 별 얘기 안했어.",Oh I just now didnt state anything,0.725567,0.734865,0.708760
...,,1.000000,1.000000,1.000000
너 이상한 생각 하는 거 아니지?,Arent you thinking weird,0.514899,0.588587,0.839319
이상한 생각할 거 뭐있냐?,comprise there anything strange to cogitate about,0.710281,0.651398,0.794464
"야, 오해하지마라. 진짜! ",Hey dont experience me incorrect Really,0.544348,0.544348,0.774420
내가 뭐라고 했어? 왜 도둑이 제발 저려?,What practice I state Why exist thieves delight,0.583746,0.643556,0.757249
...,,1.000000,1.000000,1.000000
...,,1.000000,1.000000,1.000000
생각해보니까 기분 나쁘네. 도둑이 제 발 저리다니... 뭔 뜻이야?,I finger regretful when I suppose about it The thief follow stepping on me What get along you intend,0.638347,0.633983,0.762452
왜...?,Why,0.776393,0.776393,0.843826
뭔 뜻으로 그런 얘기를 해?,What get along you entail by that,0.623874,0.669243,0.760413
별 뜻 없어...,It doesnt mean anything,0.631115,0.725296,0.796768
"야, 너 제발 좀 그러지 마라!",Hey please dont get along that,0.535144,0.600205,0.804131
머리 좀 만지지마. 제발...,Dont touch your principal please,0.538764,0.608759,0.743313
... 얼∼ 많이 컸다? 베키. 많이 컸어.,how big cost it Becky It cost really big,0.588237,0.571418,0.732593
그런 식으로 얘기 하지 마. 내가 니 부하냐?,Dont talking like that be I your subsidiary,0.563036,0.661139,0.759799
"왜 그래? 장난이야, 임마.",What make up it Its a jest homo,0.620368,0.705916,0.746333
...,,1.000000,1.000000,1.000000
그래도 엄마가 공부하라고 하는 거 보다는 낮잖아!,Its even so low-pitched than what my mommy say me to consider,0.537255,0.580680,0.812006
넌 아예 학원도 안 다니 잖어.,You dont still see academy at all,0.624262,0.634225,0.787298
"차라리 공부를 하지... 시발. 주말마다 뭐냐, 그게?",Gem State instead examine sleep with What cost it every weekend what make up it,0.548783,0.543784,0.743648
돈도 받고 좋지 뭐!,Its good to pose bear,0.463388,0.595238,0.814549
"야, 존나 빡쎄. 엄마 꽃가게 일.. 존나 짜증나!",Hey curse it mummy blossom store it lactate,0.540389,0.585714,0.811458
배부른 소리한다!!,It sounds full,0.501607,0.593088,0.754302
"얜 몰라, 공부하라는 스트레스 안 겪어봐서..",I dont experience I didnt stimulate the accent to contemplate,0.587662,0.655607,0.752392
"꽃꽂이 해, 너랑 존나 잘 어울려∼ 딱이야!",Arrange the peak and youll hold out great with you Perfect,0.648861,0.648861,0.724280
"아, 나도 엄마랑 꽃꽂이 하고 싶다!",Ah I need to blossom placement with my mummy as well,0.573866,0.563831,0.774196
"나도, 나도.",me also,0.444668,0.617812,0.701616
너네들이 정말 덩 싸는 소리 하느라 수고가 많다.,There exist a good deal of study for you roast to rattling hollo out,0.561939,0.548373,0.793605
"야, 야, 어제 존나 어이없는 일 있었던 거 알어?",Hey hey you get laid what take place yesterday,0.545911,0.660078,0.806306
뭔데?,What,0.361824,0.778105,0.692295
굴다리 쪽에서...,On the bridge deck,0.540886,0.557613,0.739244
어...,uh,0.717157,0.717157,0.506135
중삐리 새끼들이 대낮에 모여서 담배 피는게 말이 되냐? 새파란 새끼들이 여자 끼고.,practice it pretend signified for the doll to collect and fume in the heart of the solar day The blue angel skirt exist tire out adult female,0.639248,0.637247,0.744631
"진짜? 야, 우린 뭐냐?",Really Hey what personify we,0.528592,0.459336,0.717475
가만히 냅뒀어?,Did you depart it nonetheless,0.424619,0.594661,0.844261
존나 봤지!! 근데 새끼들이 존나 꼴아보는 거야? ,I project it But exist the pups calculate at me,0.587185,0.616942,0.803353
너를?,you,0.349613,0.552786,0.711230
"어... 어! 근데 쪽수 세어보니까 한 7명 되나? 괜히 잘못 했다가 쪽 당할 거 같아서 지나가려고 하는데, 생각해보니까 존나 열 받는거야 시발...",Uh Uh By the mode how many seven mass get along you matter Im travel to slip by because I call back Im get to exercise something incorrect but when I recollect about it Im stimulate furious,0.549332,0.605187,0.792814
그래서 어떻게 됐는데? 그냥 내버려뒀어?,and then what encounter Did you just now countenance it extend,0.548817,0.666685,0.817570
...,,1.000000,1.000000,1.000000
왜 얘기를 하다 마라? 어? 어떻게 됐는데?,Why dont you mouth uh How did it extend,0.548473,0.637449,0.848123
잠깐 화장실 갔다 올게.,Im conk out to the toilet for a minute,0.582793,0.632070,0.726308
...,,1.000000,1.000000,1.000000
아까 왜 그런 거야?,Why be that,0.466669,0.594066,0.769820
뭐가...?,what,0.396358,0.638208,0.743039
아까 너네끼리 시선 주고받았잖아.,You interchange center with each other,0.562871,0.673359,0.797726
무슨 소리야?,What personify you talking about,0.432368,0.624063,0.806941
아까 너네끼리 시선 주고받았잖아...,You interchange center with each other,0.562871,0.673359,0.797726
...,,1.000000,1.000000,1.000000
내가 바본 줄 아냐?,Didnt I learn you,0.370652,0.555543,0.801374
...,,1.000000,1.000000,1.000000
여기서 싸대기 맞기 싫으면 그냥 얘기해.,If you dont want to exist in hither just now tattle,0.601265,0.683230,0.777357
... ,,1.000000,1.000000,1.000000
...,,1.000000,1.000000,1.000000
애들끼리 있을 때 얘기한 거 때문에...,Because of what I enunciate when the kid embody,0.604071,0.663091,0.769659
무슨 얘기?,What personify you talking about,0.355875,0.702659,0.873618
너가 애들끼리 부모님 관련된 얘기가 나오면 아무 말도 안한다고... 아무 말도 안하다가 다른 걸로 화제를 돌린다고... 근데 그 얘기한지 얼마 안돼서 너가 또 그래서... 그래서...,When you take heed a account about your parent between your child they sound out nix They articulate nothing and and so deform the theme to something else,0.496623,0.644610,0.827592
그래서 너네끼리 눈빛 주고받은 거야? 비웃듯이?,and then get along you exchange your optic Like express joy,0.540550,0.706449,0.818848
비웃은 거 아니야. 그냥 어쩌다... 진짜 어쩌다...,Im not laugh at you Just what really what,0.538966,0.573894,0.783425
그래서 희준이랑 눈빛 주고받은 거냐고?,and then get along you interchange your optic with Heejun,0.607931,0.664528,0.804650
...,,1.000000,1.000000,1.000000
"얘기 해봐, 시발.",state me make out,0.657762,0.649128,0.761021
세정이 때문에 우리는 아예 신경도 안 쓰잖아.  그치?,Because of this we dont yet maintenance be not it,0.548296,0.698043,0.798782
...,,1.000000,1.000000,1.000000
무슨 소리야. 똑같애.,What cost you verbalize about Sami,0.574978,0.617076,0.736593
"야, 최근 일주일동안 너랑 이렇게 집에 같이 간적 없잖아.",Hey I havent constitute dwelling with you in the last workweek,0.626697,0.620331,0.782130
"알았으니까, 오랜만에 야구나 할래?",Okay after a tenacious sentence get along you desire to take on baseball,0.563368,0.609411,0.739389
됐어. 얼굴에 세정이 보고 싶다고 써져있어.,dress It enjoin that I desire to assure the cleansing on my boldness,0.680117,0.669602,0.725673
"아니야, 임마. 야구하러 가자...?",No dandy permit drop dead to baseball,0.543995,0.540047,0.759562
...,,1.000000,1.000000,1.000000
"그래, 그럼 간만에 캐치볼 하자.",Yes and so lets pick up the clump in a patch,0.680006,0.695966,0.756305
"기태야, 왜 이렇게 말이 없냐? 오늘따라...",Gitae why be you so silent Today reckon,0.688086,0.679038,0.762371
별로 할 말이 없네.,I possess naught to allege,0.560135,0.512841,0.702820
한 가지 얘기하고 싶은 게 있긴 있다. 베키.,There cost one thing I need to tattle about Becky,0.580262,0.639970,0.806325
어?,uh,0.717157,0.717157,0.506135
"넌 집에 가면 어머니가 밥해주고, 공부하라고 얘기해주지...",When you go bad home your female parent will misrepresent and tell apart you to examine,0.539139,0.540251,0.765642
... 왜 그래?,What make up it,0.807672,0.850593,0.801741
난 집에 가면 내가 밥 해먹어. 내가 알아서 다 해... 어머니가 안 계시잖아.,When I go bad place I deplete I take on caution of it You dont sustain a female parent,0.568726,0.607249,0.756916
...,,1.000000,1.000000,1.000000
"그 정도야, 그 정도가 내가 얘기할 수 있는 우리 부모 관련된 얘기야. 됐지?",Thats it thats about my parents that I can distinguish Okay,0.498534,0.639654,0.830161
...,,1.000000,1.000000,1.000000
갑자기 왜 그래...?,Why short,0.472644,0.635024,0.761906
됐냐고? ,Okay,0.230179,0.548343,0.839572
...,,1.000000,1.000000,1.000000
나 일 있어서 먼저 간다.,I die to make first off,0.557165,0.647610,0.799328
왜 저래?,Why make up that,0.707805,0.716497,0.701136
벌써 가게?,Already conk,0.589033,0.640438,0.790649
"그냥, 오늘은 공부가 안되네...",I only bevel discipline today,0.574135,0.677287,0.832619
내일 올 거지?,Will you arrive tomorrow,0.542486,0.522804,0.763581
"그래야지.  갈게, 내일봐.",I should Ill endure attend you tomorrow,0.585883,0.669028,0.780979
"어, 가.",Uh go,0.811438,0.811438,0.761757
"아버님, 아직 안가셨어요?",Father hold you represent there nonetheless,0.507021,0.565978,0.763029
생각보다 금방 나왔네.,It get along out Oklahoman than I cogitate,0.580869,0.628069,0.763798
"그냥, 공부도 안 되고 해서 집에 들어가려고요.",I scarcely desire to last plate because I tilt subject field,0.575914,0.644279,0.794448
"나 때문에 그러니, 미안하다..",So for me sorry,0.511018,0.564175,0.816810
아닙니다... 혹시 더 하실 말씀이라도...,No if you take more than to articulate,0.539862,0.523080,0.805783
다른 건 아니고...,nada else,0.614690,0.727897,0.747912
예...,Yes,0.701027,0.952860,0.693569
"아까 가르쳐준 동윤이라는 친구 핸드폰으로 전화 해봤는데, 꺼져 있더라고...",I anticipate Dongyuns protagonist cell telephone set that I instruct you before but it constitute off,0.539979,0.601415,0.801810
"아, 저도 연락 안한지 좀 돼서요...",Oh I havent represent touch since,0.549735,0.663300,0.770790
"이런 부탁해서 정말 미안한데, 동윤이 하고 연락 할 수 있게 네가 도와줬으면 좋겠다.",Im actually sorry to necessitate you to dress this but I trust you can facilitate me to contact Dongyun,0.569931,0.579360,0.782937
... 저도 어떻게... 연락 할 수 있는 방법이...,how get along I how can I get through you,0.565062,0.590846,0.838871
주변에 친구들도 있을 거고...,There will represent ally around,0.630988,0.630988,0.718495
...,,1.000000,1.000000,1.000000
부탁할게...,Please,0.452201,0.779927,0.796832
...  알겠습니다. 제가 한번 알아볼게요.,Okay complaint pick out it formerly,0.567631,0.615385,0.794806
고맙다.,Thank you,0.391793,0.542159,0.704904
아니에요. 저도 이대로는 마음이 불편했는데... 걱정하지 마세요. 연락 닿는 데로 바로 아버님께 전화 드릴게요.,No I follow uncomfortable like this Dont headache I will visit my founder equally soon as I obtain in touch sensation,0.549408,0.622095,0.775099
"그래? 학교를? ... 왜? 언제부터? ... 어... 그럼 동윤이랑 연락이 아예 안 되는 거야? 어... 어.. 혹시 너랑은 연락이 되나 해서... 아, 집 번호? 아니야, 나도 있어.. 그려... 만약에 연락 되면 나한테도 전화 좀 주라. 부탁할게. 그래 고맙다. 그래, 응...",okay schooling Why Since when Uh and so tilt you contact Dongyun at all Uh Uh I live marvel if I could contact you Oh sign bit nobelium I cause it besides draw If you commence in touch please call me Please Yes thank you Yes yes,0.570320,0.630729,0.818482
"베키, 너가 망봐.",Becky youre bankrupt,0.690561,0.678313,0.745143
"야, 베키 씹냐? 망보라니까.",Hey manage you jaw Becky Its a mess hall,0.583577,0.592176,0.725692
뭐?,What,0.511696,0.511696,0.800700
너 어차피 담배도 안 피잖아. 어?,You dont fume anyway uh,0.522253,0.652706,0.825125
"아, 진짜...",Oh really,0.670037,0.666180,0.712416
"야, 표정 풀고 망봐. 새끼야.",Hey depend up and await down infant,0.594891,0.574903,0.769897
"야, 야, 장난이야. ",Hey hey its a jest,0.577413,0.553715,0.682762
...,,1.000000,1.000000,1.000000
장난이라니까...,Its a jest,0.580407,0.630054,0.761179
알았다고... ,Okay,0.384713,0.576102,0.819518
"야, 삐졌냐? 왜 그래?",Hey exist you upset What make up it,0.604220,0.636048,0.770014
됐어...,dress,0.538268,0.800867,0.786716
"야, 화풀어. 미안해...",Hey produce angry Sorry,0.631814,0.549938,0.742351
알았어...,Okay,0.486628,0.682943,0.729526
응? 미안해. 진짜.,Huh Sorry Really,0.595200,0.617507,0.764494
알았으니까 좀... ,Okay so,0.398233,0.719424,0.845187
...,,1.000000,1.000000,1.000000
먼저 들어갈게... ,ailment endure in first,0.568300,0.683058,0.751744
"아, 시발 진짜!",Ah screwing you real,0.580648,0.613844,0.779764
...,,1.000000,1.000000,1.000000
내가 미안하다고 그랬지.,I enunciate sorry,0.456862,0.593106,0.838443
내가 미안하다고 했잖아. 어? 왜 그런 건데?,You enunciate I make up bad uh Why exist that,0.546074,0.616703,0.772378
알았다고 했잖아.,I distinguish you I acknowledge it,0.631163,0.618300,0.772240
알았다고 하면 다냐?,constitute it all you sound out,0.539976,0.585119,0.738710
...,,1.000000,1.000000,1.000000
인상 안 풀어?,Arent you print,0.545078,0.525211,0.718119
...,,1.000000,1.000000,1.000000
인상 풀라고 새끼야!,set out the opinion off,0.582725,0.582296,0.724831
"시발, 진짜. 좆같은 새끼가...",screwing real Fucking bastard,0.591661,0.634889,0.727849
전화 안받는데.,Im not respond the telephone set,0.543277,0.543277,0.674729
그래?,okay,0.635085,0.645956,0.593393
"베키, 뭔 일 있는 거 아니야?",Becky isnt there something get on,0.666248,0.686272,0.736923
별일 없겠지...,Nothing incorrect,0.675118,0.754732,0.726135
뭐 이렇게 하루 종일 자냐? 어?,What get along you sleep all daytime uh,0.667519,0.650875,0.748874
고개 들어. 이 시발 놈아.,go up your nous This fucker,0.577724,0.588125,0.682493
"예, 지금 와있거든요. ... 아니에요, 괜찮아요.",Yes I constitute hither at once nobelium its okay,0.562569,0.625519,0.795556
"제가 하고 싶어서 이러는 거예요. ... 아니에요 아버님, 안 오셔도 돼요. 만나게 되면 바로 연락드릴게요. 예... 예... 걱정하지마세요. 예... 끊을께요. 예...",Im make this because I require to No beginner you dont receive to get along I will meet you every bit presently as I touch you Yes yes dont worry Yes I will cease Yes,0.548606,0.611756,0.799698
오랜만이다.,A tenacious sentence,0.637841,0.661070,0.748492
"어, 오랜만이야.",Uh its represent a tenacious sentence,0.327561,0.678600,0.852077
잘 지냈냐?,How constitute you,0.626724,0.713144,0.829200
왜 불렀어?,Why practice you predict it,0.632258,0.619307,0.796042
동윤이 어디 있는 줄 알어?,dress you bed where Dongyun live,0.561400,0.652141,0.748501
고작 그거 물어보려고 다짜고짜 불러낸 거야?,Did you precisely prognosticate it out to need,0.537783,0.599066,0.816189
동윤이 어디 있는데?,Where live Dongyun,0.466262,0.567672,0.740972
