Original(Korean),Basic Translation(google trans),comp1 score,comp2 score,comp3 score
... 몰라... 내가 그걸 어떻게 알어. 어?,I dont fuck how make out I get laid that uh,0.646366,0.645995,0.752707
기태 아버님 만났어... 알지?,I fit your founder Giah You lie with,0.505920,0.505920,0.751508
... 얘기는 잘했냐?,Did you verbalize intimately,0.589801,0.666409,0.800021
전학 간 내가 뭘 안다고 내 번호를 가르쳐 드려...?,Im conk to learn you my issue what I get laid,0.468757,0.654200,0.823750
"아니, 아버님이 기태에 대해서 오해하고 계신 거 같으니까... 너가 제일 잘 알잖아, 기태는...",No I cogitate your forefather comprise be amiss about Gitae You jazz good Gitae constitute,0.535923,0.665789,0.817334
무슨 소리야?,What personify you talking about,0.432368,0.624063,0.806941
아버님이 기태에 대해서 오해하고 있는 부분을 제일 잘 풀어 줄 수 있는 게 너잖아... . 기태 때문에 전학 갔고...,You constitute the one who can best puzzle out the voice that your don misunderstands Because of the default I channel,0.593683,0.617902,0.767857
그게 기태 죽은 거하고 무슨 상관인데...?,What set it deliver to practice with the dead,0.572690,0.654810,0.767902
... 그냥 아버지 오해 풀어주고 싶었어.,I just now wanted to work my founding father misconceive,0.524169,0.662097,0.792543
무슨 일이 있었던 거야? 기태한테...,What find To Gitae,0.494275,0.744617,0.846321
모른다고... 그걸 내가 어떻게 알어...,I dont get laid how get along I bed that,0.567315,0.652048,0.774198
... 너 뭔가 알고 있으면서 왜 숨겨...?,why practice you cover while you bang something,0.618396,0.659271,0.758638
"시발, 무슨 근거로 그렇게 얘기해?",screwing on what footing get along you sound out that,0.614281,0.656449,0.770368
그러면 동윤이 번호를 가르쳐 드리지 왜 내 번호를 가르쳐드려? 어? 동윤이 하고 기태하고 너네끼리 있었던 일들은 왜 숨기고?,and then Dongyun will instruct you the figure Why equal you instruct me my figure uh Why make up you conceal things that Dongyun make and dont sustain,0.575800,0.607866,0.818241
"숨기는 거 없어... 나도 동윤이 번호 가르쳐 드리려고 했는데... 야, 동윤이 연락도 안 되는 애 번호 가르쳐 드려서 뭐하냐. 그나마 넌 기태에 대해서 얘기해 줄 수 있는 거라도 있지...",there nil to cover I examine to learn Dongyuns routine Hey what exist you suffice because Dongyun taught you the numeral you tilt get to Dont you order me something about Gitae,0.558991,0.648206,0.806872
...,,1.000000,1.000000,1.000000
"동윤이 새끼, 학교도 때려쳤어. 이 동네에서 본적도 없고... 봤다는 애도 없어...",Dongyoon tally the schooling I havent date it in this township I havent see anyone,0.618131,0.669996,0.779998
...,,1.000000,1.000000,1.000000
"너 가고 나서 기태, 가관도 아니었다니까. 정상이 아니었어...",It wasnt gilbert Tae or spectacles since you blend in It wasnt normal,0.633445,0.641009,0.749545
...,,1.000000,1.000000,1.000000
너가 제일 잘 알거 아니야? 기태 그런 모습...,Arent you the best It looks like that,0.578255,0.677407,0.760253
너도 마찬가지 아니냐?,Arent you the like,0.390227,0.556502,0.791463
...,,1.000000,1.000000,1.000000
...,,1.000000,1.000000,1.000000
아무 일 없다고... 몇 번을 얘기해.,zip Tell me a few sentence,0.538299,0.623613,0.806646
... 진짜지...?,constitute it material,0.695706,0.695706,0.795585
왜 그렇게 생각하는데? 희준이하고 나하고 뭐 있을 거 같애?,Why get along you recollect so What make out you recollect Heejun and Maine live dress,0.538290,0.638048,0.801374
"그냥 요즘 좀 달라진 거 같아서... 아까도 베키, 말없이 갔잖아.",I just now call up its shift a turn late Becky you went without sound out,0.588719,0.601204,0.799637
...  사정이 있겠지.,There must exist destiny,0.578748,0.764859,0.801526
...,,1.000000,1.000000,1.000000
존나 춥네... 왜 이렇게 춥냐...,Its sol cold Why be it indeed cold,0.618344,0.653031,0.753703
추운 게 아니고 무서운 거 아니야...,Its not cold its not scary,0.534634,0.518345,0.783323
...,,1.000000,1.000000,1.000000
뭐가 무서운 거야. 다 끝났잖아...,Whats scary Its all over,0.459180,0.595452,0.798586
모르겠어...,I practice not be intimate,0.397744,0.687841,0.860455
"병신 새끼, 넌 싸움 같은 거 하지마. 존나 깜냥도 안 되면서... 항상 싸우기 전에도 그렇고, 싸우고 나서도 그렇고, 이렇게 무서워서 떨잖아.",You asshole dont coiffe anything like agitate I cant even constitute storm Its incessantly before crusade even after oppose and Im daunt because Im daunt like this,0.578912,0.631671,0.781132
...,,1.000000,1.000000,1.000000
애들이 이거 알면 얼마나 실망하겠어. 너가 이렇게 떨고 있는 거 보면...,How let down the nipper would constitute if they sleep together this If you take in this shakiness,0.569658,0.696365,0.769773
그래서 안 보여주잖아...,and then you dont present me,0.678036,0.675321,0.747486
그래... 대견하다.,Yes its boldface,0.648117,0.716034,0.764477
...,,1.000000,1.000000,1.000000
일어나. 들어가자...,ignite up net ball endure,0.690489,0.682250,0.730036
얼굴 왜 이래?,Why be you set this,0.603511,0.594138,0.773144
별일 아니야...,Nothing,0.473720,0.720407,0.808037
누가 이런 거야?,Who cost this,0.539819,0.667219,0.754292
...,,1.000000,1.000000,1.000000
누가 그런 거냐고? 얘기해봐.,Who exist that lecture to me,0.622953,0.680012,0.789486
... ,,1.000000,1.000000,1.000000
뭐야?,what,0.396358,0.659352,0.714109
왜 그래?,What make up it,0.807672,0.850593,0.801741
뭐하는 짓거리야.,What constitute you get along,0.622424,0.638127,0.779503
"뭐가, 임마?",What fop,0.426094,0.591474,0.723486
왜 그래... 진짜?,Why Really,0.546217,0.609897,0.819387
몰라서 묻냐?,practice you not do it,0.697948,0.743586,0.811555
"흥분하지 말고, 차근차근 얘기해봐.",Dont become wind up just now babble out about it,0.537783,0.550215,0.792752
"좆같은 새끼들아, 뭐하는 짓거리냐고!?",get laid bastard what constitute you get along,0.578227,0.624594,0.762816
너... 말이 심하다...?,Are you regretful,0.418979,0.418979,0.718019
"닥쳐, 시발!",Shut up screwing,0.640256,0.622487,0.734295
뭐!?,What,0.511696,0.511696,0.800700
가만히들 있어!,stoppage yet,0.617229,0.677787,0.717436
"어떻게 된 거냐고, 어!?",What chance eh,0.579957,0.586939,0.783202
흥분하지 말고...,Dont get wind up,0.443671,0.487008,0.781197
..!,,1.000000,1.000000,1.000000
둘이 얘기하자.,Lets tattle,0.582629,0.776027,0.816840
얘기해봐. 왜 그런 거야?,talking to me Why exist that,0.619819,0.668509,0.785120
...,,1.000000,1.000000,1.000000
왜 그런 거냐고? 이유가 뭐냐고!?,Why exist that What equal the grounds,0.565692,0.663745,0.780539
희준이가 너한테 얘기하디?,Heejun separate you,0.580756,0.602556,0.849410
희준이는 아무 말도 안했어. 너네 반 애들한테 물어봤어.,Heejun didnt sound out anything I ask your classmates,0.604268,0.653675,0.799406
그래?,okay,0.635085,0.645956,0.593393
"왜 그런 거야, 어?",Why exist that huh,0.640448,0.736261,0.661200
내가 뭘 어쨌다고...,What practice I get along,0.557178,0.674216,0.784877
모른 척하지 말고 새끼야!,Dont venture you dont get laid,0.578566,0.615363,0.779781
왜 그렇게 오바해? 베키가 너한테 그렇게 특별하냐?,Why exist you thusly overly wrong Is Becky and then special to you,0.560163,0.627256,0.783366
그걸 말이라고 해? 어!?,state it uh,0.502051,0.712840,0.802635
걔가 자초한 거야.,He follow selfwilling,0.569273,0.620995,0.756938
좆까지 말고... 너가 희준이 얼굴 저따위로 만들 정도로 희준이 걔가 뭘 그렇게 잘못했는데!? 어!?,Dont get laid up What make out he answer and then incorrect that Heejun get to front like that uh,0.574357,0.625409,0.818246
너가 뭘 아냐?,What answer you bed,0.522520,0.522520,0.692844
모르니까 얘기 해보라는 거 아니야!?,Im not asking because I dont get laid,0.635920,0.664377,0.779208
...,,1.000000,1.000000,1.000000
"얘기 해보라고, 왜 이러는지?",state me why be you execute this,0.560040,0.678849,0.788304
그냥 단순해... 애새끼가 존나 가식적이야...,Its just now that simple That prick constitute preposterous,0.666611,0.666611,0.734654
뭐가 어떻게 가식적인데? 어?,How get along you dissemble uh,0.613722,0.727147,0.771180
마음에 안 든다고. 됐냐?,I dont like it exist it okay,0.595029,0.595029,0.757571
장난 까냐? 똑바로 얘기해보라고!,Are you jolly me talking straight,0.523606,0.617731,0.825128
신경 쓰지 말라고! 시발!,Never brain screwing,0.460813,0.574276,0.815504
...,,1.000000,1.000000,1.000000
... 보통은 내가... 다 하잖아... 얘기... 어?,commonly I Im make out Talking uh,0.561358,0.616556,0.748814
...,,1.000000,1.000000,1.000000
근데 이번에는 자세히 얘기 안 해도 이해해줘. 설명 못하는 것들도 있잖아...,But this sentence if you dont tattle in point please understand Some matter you slant excuse,0.617452,0.671352,0.748857
이제 그만해.,cease it straight off,0.555468,0.671745,0.730815
....,,1.000000,1.000000,1.000000
너가 아무리 친한 친구라도... 이건 진짜 아니야. 한번만 더 이런 일 있으면 나도 가만히 안 있어...,No topic how closely you cost this make up not existent If there one more affair like this Im yet not,0.541742,0.613993,0.786888
가만히 안 있으면 어떻게 할 건데?,What would you exercise if you didnt bide still,0.616350,0.669859,0.749389
그건 보면 알겠지.,You will reckon that,0.536349,0.665659,0.818224
...,,1.000000,1.000000,1.000000
"뭐, 과자라도 먹을래?",What execute you desire to deplete,0.535459,0.515815,0.796745
됐어...,dress,0.538268,0.800867,0.786716
배고프잖아. 저녁도 안 먹었다며...?,Youre hungry You enunciate you didnt yet sustain dinner party,0.635838,0.621256,0.737292
괜찮어...,Its okay,0.472434,0.688551,0.850525
너 있을만한 곳 다 찾아봤어. 폐역사도 가보고...,I look for all the shoes you might constitute conk to come together story,0.592193,0.573303,0.770679
... 그래?,okay,0.635085,0.645956,0.593393
재호도 만났어...,I cope with Jaeho,0.504247,0.512711,0.736120
...,,1.000000,1.000000,1.000000
재호 얘기로는 이 동네에서 아예 안 보인다며...?,Jaeho enunciate you tilt go steady at all in this townspeople,0.648308,0.665302,0.771213
... 언제는 보였나...,When get along you go steady,0.641495,0.590230,0.738164
그러게... 학교는 왜 그만 둔거야...?,indeed why practice you depart school day,0.572267,0.637604,0.807715
그런 좆같은데 다녀서 뭐하냐...,Whats conk out on with that sleep with,0.564525,0.611914,0.791530
그럼 뭐하는데?,and so what represent you practice,0.566515,0.612948,0.793998
"그냥 뭐, 검정고시 보던지 해야지...",I but stimulate to get along the black exam,0.601526,0.616231,0.746889
넌 안 마셔?,Are you not toast,0.506510,0.527331,0.701198
어? 됐어... 전학 간 학교에서는 별일 없고?,uh Its okay cost it a big business deal at a transfer school,0.593265,0.633725,0.779377
그냥 공부만 하고 있어... 어머니는?,Im precisely read Mother,0.366799,0.542872,0.821499
"알잖아, 평일 날 늦는 거.",You make out its late on weekday,0.581550,0.729904,0.811150
잘 계시지?,How constitute you,0.600387,0.632102,0.801339
그럼...,and so,0.722957,0.778066,0.649256
...,,1.000000,1.000000,1.000000
연락 못해서 미안하다...,Im sorry I couldnt middleman you,0.531612,0.644795,0.776062
아니야... ,no,0.179473,0.576940,0.711230
그냥 찾아온 거야?,Did you hardly get,0.571450,0.696199,0.769489
오늘 기태 아버님 뵀어...,Today Taetaes beginner break,0.605512,0.643801,0.714135
그래...?,okay,0.635085,0.645956,0.593393
너 만나고 싶어 하시더라고...,You wanted to contact,0.575925,0.659837,0.827014
왜?,Why,0.776393,0.776393,0.843826
너한테 묻고 싶으신 게 있나봐.,There must make up something you need to involve,0.630450,0.644874,0.772381
...,,1.000000,1.000000,1.000000
왜 기태 장례식 때도 안 왔어?,Why didnt you get along to the funeral of Taetae,0.637058,0.650329,0.759272
...,,1.000000,1.000000,1.000000
무슨 일 있었던 거야?,What occur,0.344220,0.705066,0.841277
작년 이맘때 셋이서 놀았던 거 기억나? 우리 집에서 자고...,practice you call back act as with the three at this time last class I sleep in my house,0.606714,0.653616,0.730721
기억나지...,I recollect,0.556877,0.556877,0.622089
"그때 너 소파에서 잘 동안에, 기태랑 둘이 이 식탁에서 오랫동안 얘기했었는데...",Back and so while you constitute sleep on the couch Kitae and the two of you lecture for a tenacious sentence at this table,0.672946,0.680728,0.738492
그래...?,okay,0.635085,0.645956,0.593393
그때 일들이 생각나네...,and so I think back things,0.577301,0.685561,0.739063
무슨 일 있었는지 나한테 얘기 안 해도 돼. 근데 기태 아버님하고는 너가 만났으면 좋겠다...,You dont stimulate to separate me what chance But I desire you to run into with my Church Father,0.527813,0.584861,0.834475
...,,1.000000,1.000000,1.000000
너가 기태 일에 관련돼서 아는 게 있는지 모르겠지만... 아버님은 무슨 얘기든 간에 알 자격이 있잖아. 기태 아버님이시잖아...,I dont get laid if you live anything tie in to the business but you merit to make out whatever youre utter about Youre my founding father,0.579296,0.669344,0.794483
...,,1.000000,1.000000,1.000000
내가 번호 적어 놓을 테니까 연락 한번 드려. 아니면 너 핸드폰 켜놓고 있던지... 핸드폰 켜 놓으면 아마 전화가 올 거야. 부탁이니까 피하지만 말아...,Ill pen down the crook indeed kick in me a phone call Or maybe you constitute deform on your prison cell headphone If you turn on your prison cell sound you will probably pick up a claim Please practice not invalidate because its a favor,0.583780,0.615593,0.757761
... ,,1.000000,1.000000,1.000000
여기까지 와서 이런 얘기밖에 못해서 미안하다.,Im sorry Ive cost hither indeed far and can solely verbalize about this,0.570004,0.562232,0.731529
나야말로 미안하다. 오랜만에 봤는데 반갑게 맞아주지도 못하고... 나중에 좀 정리 되면 한번 보자.,Im sorry Ive pick up it for a tenacious prison term but I cant over greet you Ill project you later on if it commence separate out,0.568288,0.597481,0.817054
그래... 다시 예전의 동윤이로 돌아와.,Yes ejaculate backward to the old Dongyun,0.608346,0.587811,0.741431
...,,1.000000,1.000000,1.000000
... 기태가 마지막으로 나한테 준거야.,This exist the last matter Gitae present me,0.621378,0.581372,0.740052
...,,1.000000,1.000000,1.000000
뭐하는 거야?!,What personify you set,0.580752,0.566435,0.772645
왜?,Why,0.776393,0.776393,0.843826
"뭐, 그렇게 세제를 많이 넣어? 어?",What indeed much detergent uh,0.545695,0.733590,0.787540
이정도면 되는 거 아니야?,Isnt this enough,0.560993,0.711445,0.783972
줘봐!,collapse it,0.506254,0.509790,0.748618
오늘같이 우리 집에 와서 해줘라.,get along to our sign like today and manage it,0.538349,0.616203,0.759348
헛소리 하지 말고.,Dont cost bullshit,0.524334,0.539496,0.721485
진짜야. 진짜! 나도 안 믿었는데 사진이 이번에 제대로 찍혔다니까.,rattling Really I didnt think it either but the image constitute convey this sentence,0.611127,0.699195,0.785284
"유에프오 사진 뻔한 거겠지, 뭐...",Its obvious that Yufos exposure constitute well,0.574419,0.574419,0.687137
"아니야, 이번엔 제대로야.  이렇게 저공비행하는 사진이라니까!",No this constitute fine This constitute a lowflying photograph,0.590712,0.642121,0.761181
넌 왜 맨날 그런 거에 관심 갖냐?,Why be you always concern in that,0.593281,0.608803,0.786789
그래서 싫어?,and then detest it,0.864785,0.860122,0.725978
야 저기 잠깐 가보자.,Hey rent conk out there,0.662294,0.603092,0.799304
뭐야?,what,0.396358,0.659352,0.714109
한판만 하자...,net ball hardly wager,0.537936,0.537936,0.715408
그냥 가∼,just now go,0.604356,0.716307,0.699220
한판만∼,only when round,0.560730,0.695412,0.805115
이거 해봤어?,get you sample this,0.493292,0.797199,0.712233
응. 옛날에...,Huh Long ago,0.573463,0.620678,0.631777
너도 할래?,Would you manage it besides,0.554365,0.644481,0.807288
됐어...,dress,0.538268,0.800867,0.786716
그러게... 둘이 마치 사귀듯이 붙어 다녔었잖아.,So they cost hanging out as if they constitute go steady,0.618951,0.662735,0.776549
...,,1.000000,1.000000,1.000000
너가 한번 잘 얘기해봐.,Say good so long one time,0.516370,0.575471,0.801761
얘기했는데... 희준이는 아무 얘기도 안하고 기태도 얘기를 안 하네...,I distinguish him Heejun doesnt enjoin anything and Gitae doesnt talking,0.564664,0.633292,0.822157
둘 다 말 못할 정도로 심각한 일이 있나...?,Is there anything sober plenty to tell apart you both,0.587298,0.588307,0.758434
모르겠어...,I practice not be intimate,0.397744,0.687841,0.860455
사정이 있겠지...,There must exist destiny,0.578748,0.764859,0.801526
...,,1.000000,1.000000,1.000000
...,,1.000000,1.000000,1.000000
웃는게 어울려.,It courting you to smile,0.487580,0.570460,0.782418
... 낙인 찍혀 본적 있어...?,take in you always personify denounce,0.565578,0.573974,0.709355
낙인이라니...?,brand,0.513597,0.602367,0.776623
사람들한테 낙인찍힌 적 있어...?,stimulate you always constitute stigmatize by mass,0.592364,0.646345,0.741864
그건 왜?,Why exist that,0.628272,0.628272,0.661488
그냥...,just now,0.660202,0.682304,0.635771
어디 봐봐? ,Where perform you appear,0.440025,0.498229,0.788133
뭐야?,what,0.396358,0.659352,0.714109
낙인 같은 거 없는데...,Theres no stain,0.526845,0.618995,0.782138
됐네요.,Thats it,0.611439,0.714877,0.793529
똑바로 걸어.. 다쳐∼,Walk uncoiled stick spite,0.565669,0.675649,0.765040
네 얼굴 볼라고.,see at your boldness,0.584471,0.593870,0.729461
잘생긴 얼굴 한 번 더 보고 싶냐?,get along you require to meet another handsome aspect,0.582646,0.594384,0.775581
됐어∼ 누가 너 본데?,Okay Who see you,0.320390,0.560098,0.810591
그럼 뭔데?,and so what personify it,0.598501,0.654287,0.672767
널 보고 있으면 내가 보여.,I assure you when I go out you,0.523245,0.561601,0.768637
뭔 헛소리야?,What represent you babble out about,0.560028,0.518554,0.740286
내가 보고 싶은 모습이어서 너무 좋아.,I like it because its what I want to go out,0.559333,0.573704,0.778261
"야, 내가 거울이냐? 너가 보이게...",Hey follow I a mirror shuffling you visible,0.561889,0.531084,0.694932
응 거울...,Yeah mirror,0.701616,0.701616,0.676769
보고 싶은 모습이어서 좋아.,I wish it because I want to go out it,0.537392,0.544444,0.718430
안 잤어?,Didnt you log Z's,0.449422,0.669176,0.872775
잠이 안오네.,I slant sleep,0.632872,0.632872,0.695163
희준이는?,Heejun,0.651075,0.687896,0.808277
소파에서 아주 푹 잔다.,I log Z's rattling good on the lounge,0.611949,0.513888,0.714338
나도 한잔 줘.,turn over me a potable too,0.536905,0.536905,0.717357
왜 안자고 일어났어 임마?,Why make out you ignite up,0.548997,0.624091,0.794989
... 나도 잠이 안와∼,I slant sleep,0.490086,0.543756,0.712209
자 새끼야.,Now infant,0.592399,0.570936,0.711612
너나 자 병신아. 딸 칠 생각하지 말고.,You and me exist sick Dont mean about impinge on your daughter,0.606615,0.625093,0.795441
병신 새끼.,bastard sonny,0.702230,0.687409,0.698856
중학교 때는 나한테 병신이라는 소리도 못하더니... 많이 컸어...,When I exist in junior high-pitched school day I couldnt still pronounce that I cost an shit,0.566351,0.630616,0.774281
그때하고 지금하고 같냐? 지금 너가 내 상대가 되냐?,make up it the like as and so and nowadays make up you my opponent today,0.565768,0.634632,0.758671
얼씨구. 늦바람이 무섭네. 좋냐? 애들 위에서 짱 행세하는 게?,What The late nothingness constitute scary Is it good feign to make up on top of the kid,0.636596,0.636596,0.743126
좋지. 내가 짱인데...,good Im great,0.431535,0.688929,0.825370
병신...,bastard,0.715090,0.726503,0.675624
...,,1.000000,1.000000,1.000000
졸업하면 다 애들 소꿉장난이잖아...,When you graduate they constitute all Thomas Kyd represent,0.547212,0.622426,0.770398
내가 모르는 얘길 해 새끼야... 먹어 버리기 전에∼,enjoin me what I dont know babe before I exhaust it,0.563747,0.658351,0.807431
미친 새끼...,weirdo cunt,0.588878,0.623019,0.702767
그 전까지는 미친개 노릇 해야지.,Until and so you stimulate to exist a crazy hotdog,0.624011,0.698859,0.767645
지가 미친개인줄은 알아요.,I be intimate you represent crazy,0.537098,0.599125,0.737613
이렇게라도 주목 받는 게 좋아. 애들 앞에서 허세 부려서 좋은 게 아니야. 주목받은 적이 없으니까...,Its good to engender care like this Its not good to cost bluffing in front of the child I take in never cost detect,0.644023,0.625506,0.754259
... 병신 새끼... 왜 그렇게 남 신경 쓰냐?,asshole Why make you care and then much,0.601575,0.663672,0.772014
그러게... 넌?,indeed you,0.683200,0.796353,0.696497
난 안 그래..,Im not,0.655913,0.627758,0.772291
잘났다. 새끼야.,Great infant,0.603588,0.724716,0.719636
없어질 거에 너무 목 매달지마...,Dont exist and then hungry that it will vanish,0.585064,0.588453,0.744928
"그래도... 다 없어진다고 해도... 나한테는 너가 있잖아. 내 마음 알잖아, 너는...",But yet if its all run I experience you You love my mettle you,0.543450,0.642691,0.806883
지랄한다.,Its damned,0.570053,0.600154,0.746298
중학교 때도 넌 알아줬잖아. 다시 사람들 사이에서 비참해지더라도... 너만 알아주면 돼. 그럼 됐어... 그럼 된 거야...,You sleep together in middle schoolhouse still if you turn miserable among citizenry once again you simply necessitate to experience so its dress and so its set,0.559808,0.651992,0.791226
...,,1.000000,1.000000,1.000000
...,,1.000000,1.000000,1.000000
"여보세요? 누구세요? 아... 예... 안녕하셨어요. ... 예, 아버님... 희준이 한테 얘기 들었습니다. ... 예... 예... 지금요?  아니요. 괜찮습니다. 알겠습니다.",Hello Who Ah yes good dawn Yes pappa Heejun listen this yes yes right away no mulct Okay,0.458518,0.676766,0.857222
왜 보자고 한 거야?,Why perform you need,0.609174,0.651384,0.703247
...,,1.000000,1.000000,1.000000
어?,uh,0.717157,0.717157,0.506135
꼭 그딴 식으로 물어야 겠냐?,Should I inquire that agency,0.551528,0.710898,0.781629
...,,1.000000,1.000000,1.000000
왜 불렀겠냐? 어?,Why would you prognosticate it uh,0.693277,0.738071,0.786278
희준이 얘기야?,make up Heejun talking,0.653459,0.653459,0.740350
...,,1.000000,1.000000,1.000000
둘 사이에 무슨 일 있었던 거야?,What chance between the two,0.524359,0.677465,0.779183
너가 세정 이한테 정신 팔려있으니까 모르지...,I dont know because youre constitute trade to Jungsoo,0.573585,0.648514,0.794344
그러니까 얘기 해보라는 거 아니야?,and then youre not postulate me to lecture,0.639413,0.693480,0.748650
...,,1.000000,1.000000,1.000000
세정이 많이 좋아하냐?,suffice you like make clean a great deal,0.583283,0.545653,0.720622
응?,Huh,0.539445,0.539445,0.476177
세정이 많이 좋아하냐고?,suffice you like make clean a circumstances,0.553351,0.547896,0.760159
갑자기 그건 왜?,Why comprise that short,0.638544,0.638544,0.688980
얘기해봐...,evidence me,0.732253,0.732253,0.753128
"미친 놈 물을 걸 물어, 새끼야. 희준이 얘기 하려고 불러놓고는 왠 헛소리야?",Im blend to postulate you for a routine of piddle mother fucker Why cost it bullshit when Heejun prognosticate it up to babble out,0.606150,0.606463,0.750138
... 대답 해봐...,answer me,0.514222,0.646040,0.854750
... 왜 갑자기 이래?,Why comprise this sudden,0.693806,0.693806,0.740038
세정이 많이 좋아해?,suffice you like clean a circle,0.568796,0.625176,0.823615
어... 좋아한다. 됐냐?,Uh I care it comprise it okay,0.573224,0.569666,0.749813
... ,,1.000000,1.000000,1.000000
그건 난데없이 왜 물어? 미친 새끼야!,Why exist it nowhere to ask weirdo love child,0.544523,0.668299,0.762700
그냥 부러워서 물어 본거야. 여자 친구도 없고... 어떤 기분인가 해서...,I personify precisely envious and take I dont suffer a girlfriend I find like,0.548238,0.607346,0.768314
싱거운 놈...,A sweet bozo,0.636407,0.557884,0.675210
...,,1.000000,1.000000,1.000000
저번에 애들하고 놀 때...,The last sentence I act as with the tike,0.569676,0.639408,0.739710
응...,Huh,0.539445,0.539445,0.476177
그때 보경이가 너한테 고백했었잖아. 그때 받아주지 그랬어?,At that prison term Bokyung confessed to you Why didnt you contain it back and then,0.602196,0.609655,0.796580
어떻게 알았냐?,How did you get laid,0.603866,0.658955,0.759070
