Original(Korean),Basic Translation(google trans),comp1 score,comp2 score,comp3 score
재산은 100억정돈데 거의 부동산예요. 건물 세 개. 배가 15척. 땅 있고.,holding live 10 billion but it embody nearly real land threesome construction 15 gravy holder There constitute solid ground,0.620024,0.642846,0.792995
요새는 서해개발이라는 회사 차려놓고 전주 군산 왔다 갔다 하는데 선주들한,The fort sic up a caller prognosticate Seohae Development and exit to and from Gunsan Jeonju,0.629062,0.593707,0.759791
그래서 현찰은 없다?,So there represent no immediate payment,0.411957,0.674439,0.816279
네. ,Yes,0.701027,0.952860,0.589453
오케이! ,okey,0.784376,0.893096,0.782275
배는 끽해야 척당 5-6천이고 양식장 면허권을 사라고. 어업보상해줄 때 서류만 있어도 장당 1-2억이야. 요새 전라북도 티켓다방 애들도 군산으로 주민등록만 옮기면 500씩 받아쳐먹는데. ,The gravy holder is 56 thousand per chow so buy a farm permit When it add up to fishery compensation yet if there represent written document its 200200 million win per flat solid fort Jeollabukdo tag cafe yet if they go their resident physician readjustment to Gunsan eat 500 each,0.629082,0.628439,0.754242
새만금 왜 하나 몰라요. ,I dont know why Saemangeum,0.495059,0.631697,0.778175
원래 난리때 돈 버는거야. 김사장 500 준비해. 예림씨! 맘 편히 쳐요. ,earlier I make water money when I be upset Get ready for the 500 Chief Executive Yelim Relax,0.596889,0.609114,0.767687
안들어가면 어떡해요? ,What if I dont go in,0.644801,0.669729,0.810816
그게 왜 안들어가? 공 앞에서 방구만 껴도 들어가겠네. ,Why doesnt it act yet if I scarcely wear off a break wind ball in social movement of the ball I will go in,0.542229,0.607350,0.802253
어머. ,Oh,0.115470,0.317595,0.779479
아니 어떻게 그걸 못넣요? 그거 그냥 툭- 아이 진짜. 운동센스 그렇게 없나? 참... 비오기전에 한 홀 더 돌아. ,No How can I not position it Thats exactly mishandle substantial Is there no more use sensory faculty actually one more bout before it rains,0.571990,0.652830,0.761901
저는 여기서 내려주세요.,Please shake off me off here,0.598550,0.697311,0.776060
우리 예림씨 화났어? ,Are we angry,0.459428,0.517584,0.829795
오백만원이 그렇게 아까우세요? ,be 5 million win so precious,0.476374,0.574115,0.788949
"돈이 아까운게 아니라, 내기는 어쨌거나 이겨야지. 지면 나 잠 못 자는 사람이라. ",Its not a waste product of money but I look anyhow If I fall behind I pitch sleep,0.612578,0.647852,0.768880
정말.. 너무해요.  나도 사람인데 실수할 수도 있는거고... 거기서 그렇게 무안을 주고. ,real too much I am a individual but I can bring in misapprehension,0.515316,0.600525,0.814606
이거 참.. 진짜 울어? 내가 나쁜 놈이야. ,constitute this actually genuinely squall Im a regretful cat,0.503783,0.622624,0.825681
미안해요. 화내서. ,Sorry In wrath,0.392882,0.602502,0.791359
아니야 아니야. 예림이! ,no no Yelim,0.358223,0.611007,0.785330
"자기가 내일 남편 화투치러 간 것 같다고 호구한테 전화해. 그래서 판때기에 같이 가.  그래서 판에 앉혀. 딱 이틀 잃어줘. 삼천씩.  6천 결재해주고, 자기는 운전해줄 때마다 화투는 치지 말라고 사발 풀어. 너무 꽉 조이진 말고. ",prognosticate Hogu that he think He get to own a battle tomorrow So lease pass away together in the securities industry So sit on the photographic plate Just fall back two day Three thousand each After pay 6000 he unscramble the bowl thusly he doesnt strike each time he aim Dont make up also tight,0.621826,0.633726,0.767312
예. ,Yes,0.701027,0.952860,0.693569
잘들 해. 빨리 치고 빠져야 돼. 여기 돈 곧 마를거야. 건달들이 빠지기 시작하잖아. ,act it considerably You experience to score it chop-chop and perplex out The money here will dry out soon Its go to fall out,0.531152,0.645555,0.766570
정마담! 우린 언제부터 출근해? ,Jung gentlewoman When do we choke to form,0.525323,0.633254,0.759433
다음주 월요일. ,Next Mon,0.498907,0.604038,0.812099
여기 대전에서 온 대마이 기술잡니다. ,hither be Daemai engineering science from Daejeon,0.624568,0.622846,0.741892
보자. ,LET interpret,0.241489,0.384781,0.908018
보여드려. ,shew me,0.405279,0.490870,0.766065
차비 줘서 보내. 기술은 좋은데 탈이 안좋아. 사람들이 경계한다고. 탈은 고니가 좋은데.. 고니 수배 돼? ,charge it for the elevator car The engineering science represent good but the masquerade party personify sorry masses are wary The masquerade party represent good for Goni,0.493803,0.621478,0.799075
서울 너구리한테 박무석을 찾아달라고 했다는 것만 알고 있습니다. ,I only know that I ask the Seoul Raccoon to chance green Moosuk,0.473853,0.631495,0.835655
너구리보고 나한테 전화 좀 넣어달라고 그래. ,Look at the raccoon and inquire me to call you,0.556515,0.606983,0.815299
먹고 살기 힘들다 고니야. ,Its concentrated to eat on and exist,0.642976,0.654704,0.769052
강남 아줌마들 모이는데? 가깝지 여기서. ,Gangnam madam are meet finisher hither,0.529063,0.606668,0.800333
스트레스 받네. 갑시다. ,Im accentuate lets sound,0.681725,0.693304,0.770699
어 저기.. 오늘은 혼자 가라.  에비 에비 글로 가면 안돼. ,Uh disco biscuit unaccompanied today You cant over go away to Ebi Ebi,0.577759,0.679521,0.752800
아빠~ ,Dad,0.484082,0.484082,0.688136
응. 잘 놀았어?,Huh Did you toy substantially,0.563873,0.653285,0.813048
왠 아빠? 야! 이거 니네 아빠 아냐. ,Why dad Hey This constitute not your male parent,0.553126,0.644992,0.800925
야 너 왜그래? 애 울어.  흙장난해. ,Why equal you do that rallying cry dramatic play in the poop,0.525184,0.575037,0.826883
이쁘지? ,Isnt it moderately,0.465843,0.783379,0.871329
응. 나 혼자 갑니다. ,Huh I belong alone,0.489892,0.618967,0.758224
다 호구들이니까 팍팍 따!~,Its all hukou and then dap,0.614704,0.595215,0.758427
이 쪼이는 맛~ 오백 박어. ,This sting taste perception I couch five hundred,0.457962,0.615805,0.828514
박어? 내가 천으로 벌려줄께. 호호호. ,couch it in complaint spread out it out with a cloth Hohoho,0.533955,0.737064,0.769019
없는 집 제사만 돌아온다더니 이게 뭐야 죽으라는 놈만 죽으라는건가? 같이 박어요. ,After hark back to the house without a ritual killing what is this Put it together,0.472053,0.586472,0.813876
죽어. ,die,0.212132,0.555683,0.850525
노련하다. 구삥인데 죽는다? ,harden Im ill but I die,0.496623,0.578581,0.823639
죽어. ,die,0.212132,0.555683,0.850525
5땡인데도 죽는다? 뭐야 이 인간. ,It go yet though it be 5 What embody this human,0.628170,0.582126,0.774089
누가 선 좀 대신 잡아줘요. ,individual take hold the communication channel for me,0.431455,0.620030,0.830804
어디 가요? ,Where follow you conk,0.490697,0.489345,0.833178
물 좀 빼고 올라구요. ,It enfeeble a small,0.440196,0.525578,0.761861
패돌리다 물 빼면 끗발 떨어지는데. ,When I run out the water supply it come off,0.523278,0.624314,0.773600
같이 눕시다. ,Lets lie in down together,0.468093,0.663461,0.805038
기술은 없는거 같은데.. 낮은패로 꼬셔봐라. 일곱끗. 나는 여덟끗. ,I dont mean there equal any skill endeavor rick it with a low deal seven-spot I constitute eight,0.684560,0.669291,0.755614
여편네 참.. 없다 그래줘.  다시 선 잡아야죠. ,Yes no I own to place upright again,0.484471,0.571825,0.835317
"오줌도 눴고, 기본 천으로 시작합니다. ",I make and come out with a basic cloth,0.457011,0.569552,0.786921
그래야지. 나 막 가슴 설랠라 그래. 받아. ,I should Im but charge receive,0.508357,0.609059,0.839125
이 아줌마가 우리 영계한테 관심 많네. 정분나겠어. ,This dame be interested in our disembodied spirit human beings That would be fine,0.555158,0.626125,0.793990
정분나면 좋죠. ,Its good to represent fine,0.562043,0.524471,0.752042
천받고.. 오천 더. ,go a thousand five one thousand more,0.420910,0.596173,0.780337
추워지네. 죽어요. ,It capture cold I conk,0.503987,0.502265,0.789720
박아논게 아까운데.. 죽어. ,Its too bad to live commons Im go,0.523007,0.541786,0.804249
다 늡시다. 일억쯤 되는데. ,net ball sound Its about 100 million,0.721191,0.721191,0.717675
좋죠. ,Its good,0.459568,0.549552,0.727421
8끗! ,Eight,0.394776,0.861257,0.817797
나는 7땡인데. ,Im 7 dose,0.383032,0.658665,0.883015
저 7땡 어디서 나온거야? 나는 분명 일곱끗을 줬는데. ,Where practice that 7 dong issue forth from I unquestionably make it seven,0.608181,0.627372,0.705065
좀 쉬었다 합시다.  왜 쳐다봐? ,net ball look at a geological fault Why embody you star,0.475901,0.598487,0.809683
쪼이는거에 맛 붙였다가 아파트 하나 날렸네? ,Did you taste the pebble and and so mishandle an flat,0.656542,0.653599,0.718705
짜릿했어. 어디가서 이 기분 나겠어. 젊은친구 나가서 술 한잔 할래? ,It be charge I experience like Im pass away someplace Would you like to choke out and tope a immature booster,0.565689,0.654135,0.772814
돈 가져올테니까 한판 더 칩시다. ,Im conk to add you more money so lets arrange it again,0.636272,0.562160,0.743855
봤잖아. 다 빚 갚았어. ,You see I compensate off everything,0.512254,0.595694,0.709565
또 딸거 아냐. ,Its not daughter over again,0.516420,0.581697,0.761027
그럼 또 갚고.. 갚고..  넌 나한테 안돼. 더 배워. ,and so compensate it back wage it back you cant over determine more,0.521921,0.574203,0.755675
안되긴 뭐가 안돼? 넌 누구야? 엉? ,Whats wrong Who constitute you Huh,0.552068,0.561678,0.791320
죽여라. 어차피 이러다 죽을건데. ,toss off it Im break down to break down like this anyway,0.587312,0.658857,0.781533
짝귀? ,yet,0.416614,0.612186,0.754958
죄송합니다. 대선배님을 몰라 뵙고. ,Sorry I didnt have intercourse you,0.514474,0.665364,0.809168
술이나 마셔. ,boozing alcoholic beverage,0.481230,0.594864,0.823204
아까 일곱끗을 7땡으로 바꾼 거. ,I deepen the seventh to 7 Transportation,0.657292,0.652741,0.722598
자네도 잘 하잖아. ,You constitute good too,0.600722,0.554932,0.831788
"제가 묻고 싶은 건, 상대방이 구라를 칠거라는 걸 어떻게 아느냐는 겁니다. ",What I need to necessitate represent how do I bonk the other individual represent break down to shoot the Gura,0.616954,0.633739,0.750104
사람 맘을 읽어야지. 화투는 손이 아냐. 마음으로 치는거지. ,I own to show mass nitty-gritty Hwatu is not a paw Its a split second,0.680977,0.641342,0.781868
사람 맘을 어떻게 읽습니까? ,How do you understand the human ticker,0.615686,0.649912,0.756959
나도 모르지. 흐흐... 근데 너는 구라칠 때 내 눈을 쳐다보드라. 구라칠 땐 절대 상대방 눈을 보지마. ,I dont know Heh But search at my optic when you lean down Never wait into the other mortal center when you lean down,0.550954,0.615003,0.800364
선배님! 제가 아귀를 만나면 이길 수 있을까요? ,elder Can I succeed if I adjoin the lotte,0.519047,0.642369,0.828294
"기술을 쓰다 걸려서 귀가 잘렸고, 기술을 안쓰니까 이게 잘렸나?... 별거 아냐. 너도 곧 이렇게 될거야. 허~ 미안하다. ",My ear was contract because I was use engineering science and was it issue off because I wasnt practice engineering science You will represent like this soon Huh Im sorry,0.567453,0.625441,0.756802
어디로 가십니까?,Where cost you conk,0.547801,0.604672,0.764199
아무데나 가죠. ,Lets last anyplace,0.516249,0.593200,0.746995
아무데나요?  수목원?  그럼 연안부둔가?,Anywhere botanical garden So make up it offshore,0.517362,0.506943,0.726348
예. 아무데나. ,Yes anywhere,0.606252,0.606252,0.718423
됐어요. 여기요. ,Thats approve Here you conk out,0.438212,0.536217,0.802632
예? 아무데나가 여기요? ,Yes Anywhere here,0.450435,0.589194,0.787135
세상 좁네. ,The worldly concern is small,0.494920,0.633354,0.855202
밤새 화투 치고 왔나보죠? ,Youve been struggling all dark right,0.552351,0.552351,0.748934
음. ,considerably,0.288415,0.714264,0.908111
돈 많이 버나봐요? ,wealthy person you ready a deal of money,0.406216,0.603787,0.825754
잃었어. 한잔 할래? ,I fall behind it Would you like a drunkenness,0.441905,0.675304,0.858863
근데 왜 사람 뒤를 밟고 그래요? ,But why constitute you step on individual backwards,0.482038,0.597845,0.789946
하~ 들켰나? ,Ha Are you see,0.590456,0.549278,0.711912
그러고는 의뭉스럽게 뒤에 앉아선 ‘세상 좁네’ 그것도 반말로. ,Then sit in the back the man is narrow-minded thats too the end,0.587157,0.675162,0.820731
그때 미안했어.. 내가 맘이랑 행동하는 게 달라서.,Im sorry at that clip Im unlike from my eye,0.525578,0.604175,0.809536
바보네요~ ,Thats stupid,0.416603,0.476160,0.702656
진짜 술 안해? ,genuinely not tope,0.579905,0.727917,0.785743
... 내가 이런 얘기 하면 웃기겠죠? ,Would it cost funny if I say this,0.594098,0.692682,0.794894
말해봐. ,say me,0.261295,0.536487,0.846045
머리 좀 깎아야 되겠네요. ,I experience to trim my fuzz,0.622324,0.622324,0.738433
술 냄새 나. ,It smell out like alcoholic beverage,0.337386,0.678172,0.858091
미안해. ,Sorry,0.504823,0.580949,0.696518
재주도 좋아. ,Some natural endowment constitute good,0.319754,0.531927,0.920756
소문 쫙 퍼졌지. 저번에 곽철용이네 판대기 거덜냈대. 다시 붙을 거라는데. ,Rumors distribute It be Kwak Cheolyongs last sentence Im go to beat again,0.582495,0.671171,0.802510
머리속이 마요네즈야? 곽철용이 나발불면 대한민국 어디서도 작업 못해. 고니 내 선순데 왜 나한테 얘기안했어? 나 무시해도 돼? ,be mayo in your chief If Kwak Cheolyong drift I tilt work anyplace in Korean Peninsula Connie my sunsoon why didnt you say me Can I cut it,0.586107,0.664968,0.793128
무시하는게 아니고.. 요새 박무석이가 철용이네 앞전선수로 뛰잖아. 그래서 난 박무석이만 수배해준거야. ,Im not disregard Fortress MooSeok green cost CheolYongs go instrumentalist Thats why I only when need common Moosuk,0.574041,0.615812,0.772598
고니가 대가리 얼마나 쳤대? ,How practically do Connie come to,0.614696,0.633128,0.722486
네장쯤. ,About four,0.562968,0.658428,0.675904
고니는 절대 곽철용이랑 다시 붙으면 안돼. ,Dont lease Goni reconnect with Kwak Cheolyong,0.571303,0.653612,0.819627
살이 좀 쪘네.,I experience make headway some weighting,0.416363,0.618394,0.880801
귀신이야 귀신. 좀 앉어. ,Its a ghost Sit down,0.526074,0.671146,0.802108
됐어. 의자가 불편해보이네. 고니한테 좀 부탁할 게 있어서. ,act The electric chair calculate uncomfortable I feature something to inquire Connie,0.555168,0.663493,0.769608
벌써 부담되는데. ,Its already a core,0.534694,0.618680,0.794685
"내가 전주 군산쪽에서 공사 시작했는데, 기술자가 없네. 고니랑 광렬씨랑 오면 딱 좋을 거 같은데. 안녕하세요 고선생. ",I lead off grammatical construction in Gunsan Jeonju but there represent no technicians I think it would represent great if you get along with Connie and Kwangryul hi teacher,0.649914,0.667017,0.773147
아 예. ,Ah yes,0.784376,0.923725,0.770177
페이는 부산보다 10배! ,remuneration represent 10 time high than Busan,0.484926,0.595323,0.768346
와~ ... 나도 요샌 지갑이 뚱뚱해. ,Wow I stimulate a fatty purse too,0.640560,0.640354,0.764903
"고니씨! 식사 다 준비됐는데, 안녕하세요. ",Connie The meal is ready hello,0.444563,0.658810,0.856374
네-. 누구? ,Yeah who,0.669301,0.788723,0.762553
애인이에요. ,I am a buff,0.544975,0.544975,0.552855
어! ,uh,0.717157,0.717157,0.506135
얘기 많이 들었어요. ,Ive get wind a deal,0.732453,0.713517,0.773669
진짜요? 어디까지 들었을까? ,real How far own you see,0.514680,0.599060,0.798172
근데 보기보다 뚱뚱하네요~ ,But its fatter than it see,0.561484,0.590818,0.812538
호호 이 사람 웬만한 여자는 콘트롤하기 힘든데. ,Hoho This cleaning woman is concentrated to master,0.639825,0.639957,0.772506
글쎄요 사랑이 콘트롤일까요? ,wellspring personify know control,0.567502,0.617753,0.738293
근데 요새 패션감이 떨어졌구나.  셔츠가 이게 뭐야 너무 평범하다. 호텔 연락처니까.. 무슨 일 생기면 연락해.  또 봐요 아가씨. ,But the way good sense of the fort own fall The shirt constitute thus plain Its the hotel touch selective information link me if anything occur See you once again lady,0.628868,0.626041,0.739411
아우 여우같애. ,It calculate like a dodger,0.394126,0.568268,0.848036
어린게. 말 받아치는 것 봐. ,Loretta Young pubic louse facial expression at what you articulate,0.406658,0.601661,0.840317
자기가 나한테 빚이 얼마지? ,How much answer you owe me,0.412098,0.581832,0.843830
한 삼천되는데.. 받을라구? ,Its 3000,0.157454,0.692773,0.939658
안받을테니까 차하나 쌔벼서 전주로 갖구와. ,Im not conk to fix it thus Im die to arrest some tea and go to Jeonju,0.557578,0.612451,0.771837
진짜지? ,real,0.513420,0.583226,0.816102
서울.. 한달만 기다려라. 내가 온다 다시. ,Seoul wait a month I issue forth over again,0.459852,0.608842,0.754289
고니야 그냥 튀자. ,Connie countenance just parachuting,0.613819,0.622471,0.793327
죽으면 죽었지 도망은 안가. ,Im dead when I perish I cant lean away,0.661558,0.625682,0.770331
너야 그러지만 왜 나까지. 너 내가 좋아서 이러냐 싫어서 이러냐? ,Its you but why me be you do this because I wish it or not,0.506240,0.606019,0.806672
고만합시다. 부부쌈 칼로 물베기래는데. ,Lets embody quiet Im sound to water it with a duo wrap tongue,0.501526,0.531878,0.784197
부부는 무슨.. 저기 나 손 씻을란다. ,The match what arrange you want me to do,0.488118,0.640843,0.793431
세란이때메? ,What about Seran,0.576243,0.685058,0.739199
"애도 그렇고... 걔 이름이 희열인데, 내가 광렬이잖아.",therefore manage her Her public figure be Heeyeol and Im mad,0.612781,0.598368,0.721366
쉿! ,Shh,0.358579,0.587868,0.694253
뭘 그렇게 놀랍니까? ,What represent so amazing,0.591023,0.591023,0.707785
그러다 곽철용한테 걸리면? ,and then what about Kwakcheolyong,0.591264,0.625035,0.783763
빼팅은 자윱니다. 곽철용한테 죽든가 나한테 죽든가.,edge grows Either Kwak Chulyong or me,0.438521,0.638165,0.873157
고니야 저기,Goni there,0.673809,0.691056,0.723302
할거야 말거야? ,get along you get along it or not,0.505508,0.610265,0.827329
나한테 얼마가 떨어지는데?,How much embody come for me,0.494190,0.601589,0.724314
20% ,20,0.000000,0.000000,0.000000
고니야! ,Connie,0.734847,0.744591,0.724705
오지게 걸렸군. ,Youve grow it,0.455258,0.490229,0.808764
고니야! ,Connie,0.734847,0.744591,0.724705
왜? ,Why,0.776393,0.776393,0.843826
우리 판돈 모자라. ,We dont own enough money,0.569265,0.615883,0.815525
알아. ,Know,0.231699,0.561567,0.693569
내일 곽철용이가 자기한테 약을 탈거야. 마시지 마. ,Tomorrow Kwak Cheolyong will claim the medical specialty from him Dont drinkable,0.540012,0.653529,0.763943
에이.. 거기 수건 줘봐. ,A spring me a towel there,0.572824,0.608518,0.732632
잠깐. 무석아 니가 기리해라. ,awhile seminal fluid hither Wuxi,0.619946,0.580388,0.712776
네. ,Yes,0.701027,0.952860,0.589453
오백만! ,5 million,0.517226,0.631089,0.781077
천만 더! ,10 million more than,0.504685,0.644577,0.737926
오천만 더! ,50 million more than,0.474138,0.681893,0.704792
합이 1억으로 합시다. ,net ball add to 100 million,0.523866,0.623498,0.748183
그래? 합이 4억. 빈정 상하면 죽든가. ,okay The heart represent 400 million If youre sarcastic youre dead,0.566380,0.631336,0.790187
.... 높은건가 보죠? ,be it high,0.366290,0.701308,0.855586
높지. ,Not high,0.669767,0.669767,0.698866
높다면 우리가 또 빨아줘야지. 4억입니다. ,If its high gear we experience to suckle it again 400 million,0.632892,0.684773,0.768299
난 죽습니다. ,I conk,0.347201,0.615121,0.838075
돈 확인해봐. ,discipline the money,0.605097,0.605097,0.751512
맞는 것 같습니다. ,Seems right,0.320116,0.593280,0.876837
까봐. ,Im afraid,0.457325,0.519010,0.747878
먼저 까시죠. ,number one rent sheer it,0.378695,0.511000,0.861693
장땡! ,Long,0.593300,0.758798,0.780987
어? ... 나도 장땡인데. ,uh Im too long,0.569112,0.617040,0.813680
에이! 사십장으로 치는 게 아닌데. ,a Im not hitting forty tack,0.645408,0.667697,0.832180
이거 박아놓고 우리끼리 한번 더 돌려야죠? ,Should we lay this on and deform it over again,0.577897,0.573727,0.791493
돌려! ,change state it,0.531523,0.785049,0.790650
‘두끗? 이런..’..  얼마 남았냐? ,Clean How much how much represent exit,0.469366,0.518123,0.741350
1억입니다. ,100 million,0.500252,0.670651,0.736385
밀어 넣어. ,push button it in,0.579718,0.816510,0.795566
수표도 받습니까? 5억. ,Do you take checks 500 million,0.578574,0.648553,0.745313
용해야! 은행에다 전화해봐. ,You make to apply it cry the camber,0.569346,0.646667,0.787162
내가 오늘은 현금이 이것밖에 없는데. ,I ingest alone this cash today,0.576220,0.688627,0.803778
건물이라도 담보를 잡든가요. ,Whether its a construction or a collateral,0.607817,0.628140,0.707463
.... 음... ,considerably,0.288415,0.714264,0.908111
조흥은행이죠? 수표 조회 좀 해볼려구요... 번호 불러드릴게요. 4533...,Chohung Bank Im choke to come a hitch hitch complaint ring you the issue 4533,0.541087,0.650615,0.815971
에이. 죽었어.  넌 뭐야? ,a Dead What constitute you,0.517990,0.697868,0.753049
한끗? 한끗?,Clean Clean,0.513733,0.764517,0.796320
이 돈 착한데 쓰겠습니다. ,I will use this money for good,0.608752,0.655450,0.739666
.... 내 밑에 들어올 생각 없냐? ,Any sentiment of descend under me,0.668252,0.645798,0.722221
늑대새끼가 개 밑으로 어떻게 들어갑니까? ,How act woman chaser belong under the dog,0.629296,0.665154,0.759110
회장님 볼 면목이 없구만. 방에 가 있을테니까 부르면 연락해줘. ,You dont own the ball to watch Im get going to the way so shout me and cry me,0.532336,0.555461,0.809606
예. ,Yes,0.701027,0.952860,0.693569
잠깐. 무석이 입 좀 막아봐라. ,awhile Shut your mouth,0.361807,0.565886,0.849701
... 이 안에 배신자가 있다. 이게 내 결론이다. ,There embody a traitor inside This constitute my last,0.573190,0.687505,0.759707
전 아닙니다. ,I cost not,0.592127,0.668501,0.757596
그래?  이걸로 증명해봐. 증명 못하면 열 손가락 다 짤린다. ,okay show it with this If you pitch raise it youll take ten fingers off,0.533347,0.586633,0.819033
증명해드리겠습니다. ,I will test it,0.441041,0.780428,0.832684
이제 믿어주시겠습니까? ,Would you think me today,0.545022,0.604922,0.795235
믿어달라고? 결백하다는 놈이 손가락은 왜 잘라? ,Trust me Why do a man who is clean-handed cut his digit,0.598050,0.591385,0.767479
어디서 만나기로 했어? 응? ..... 어디? ,Where follow you say to conform to Huh where,0.485939,0.513265,0.705207
박무석이가 왜 안오지? 걸렸나? ,Why isnt green Moosuk issue forth Did you stimulate it,0.520001,0.596042,0.809663
빠꼼이라 괜찮을텐데. ,It would live okay because it is fast,0.571680,0.682197,0.711209
아.. 오줌 마려워. ,Ah Im not wee,0.398531,0.623882,0.831451
형님! 가게에서 기다려. 여긴 내가 있을테니까. ,chum postponement at the computer storage I will be hither,0.607230,0.612901,0.707445
그럴까.  ,I question,0.611253,0.642613,0.702747
형님! ,chum,0.337983,0.640121,0.773274
왜? ,Why,0.776393,0.776393,0.843826
내가 혹시 화란이랑 살면 재미있을까? ,Would it be fun if I go with Hwaran,0.422712,0.524982,0.820274
요거 끊고?,discontinue this,0.587975,0.726117,0.764033
응. ,Huh,0.539445,0.539445,0.476177
너는 성격이 드러워서 .. 잘 살거야. ,You take in a good personality you will be substantially,0.598313,0.705639,0.756227
.... 화란이? 형님 바꿔봐. 빨리.... 형님! 다구리 탔어. 튀어요. ,Hwaran modification your pal Quick chum I depend upon a daguri leaping,0.607421,0.644261,0.751427
세란아! 나 꼭 돌아온다. ,Seran I unquestionably get along back,0.486823,0.588681,0.802942
데려가. ,conduct it,0.741403,0.778269,0.731679
너 명이 길구나. ,You represent long,0.658428,0.658428,0.736900
화란이 세란이 사러왔습니다. ,Hwaran represent hither,0.515057,0.585363,0.804127
돈으로? ,With money,0.342365,0.443177,0.677326
그게 경우 아닙니까? ,Isnt that the sheath,0.606971,0.729669,0.719480
