Original(Korean),Basic Translation(google trans),comp1 score,comp2 score,comp3 score
아귀랑 붙여줘. 뭐해? 돈따러 갑시다. ,Attach it with the angler What are you arrange Lets sound for money,0.477663,0.632774,0.767783
난 그때 가슴이 철렁했어요. 언젠가 고니가 죽을 것 같애서. 그리고 때가 되면 날 버릴 거라는 걸 알았거든요. 근데 생각보다 그 날이 빨리 왔죠.,At that fourth dimension my core was full I call back Connie will drop dead someday And I have intercourse that when the fourth dimension get along they would will me But the day get along sooner than I retrieve,0.656661,0.660215,0.748923
땡이냐? 땡이냐? ...옳지 옳지 헉! 니미 개패네. 몰라! 질러먹어. 화투가 패로 치냐? 돈으로 치지. ,Is it Ding Is it Ding right wing or wrong Its Niimi act not jazz Eat it Are you defend tally with money,0.666455,0.654485,0.796669
빨리 합시다. 돈 딸 시간도 없는데... ,Lets practice it promptly I dont take sentence to garner money,0.511608,0.568770,0.798015
돈으로 으악을 지르네. ,I shout out with money,0.509532,0.663259,0.799786
무서우면 죽으시던가. 좆이 무서우면 시집을 가지 말아야지. ,If you are dash you break If youre frighten away dont get tie,0.528857,0.618037,0.826129
확인! ,Confirm,0.370612,0.370612,0.583308
화투에 침을 발라놨나? 왜케 안 떨어져. 이겼다. 크하하 이런 패로 먹었어? 광렬아 이 사회가 아직 정의는 살아 있나보다. ,Did you spit on the canvas tent Why not I make headway Haha manage you run through with this paw Kwangryeol perhaps this fellowship notwithstanding own judge,0.583975,0.591684,0.757146
광렬아~ 높은 거 하나 떠라. 오늘 너 끗발 좋을거야. 여기 있는 돈 다 따고 중고차도 한대사고 자 광렬아! 중고차다 중고차!  크으윽~ 호! 호!  ,fury Take one heights one Today you will be nice LET perplex all the money hither and buy a used auto employ auto apply machine Ugh Ho identification number,0.601165,0.615171,0.777176
아가리 좀 닥치고 합시다. ,Lets shut out up a small snatch,0.543806,0.641959,0.730428
돈딸라고 치나? 재밌자고 치는거지. ,Are you a girl Its play,0.349579,0.591486,0.882003
죽어. ,die,0.212132,0.555683,0.850525
또 내가 먹어? 크크크 ,I rust once again chow,0.753412,0.763849,0.722424
천만원 올려놔도 되죠?,Can I couch 10 million win,0.507086,0.558700,0.816382
받으신다고? ,You go it,0.414029,0.426358,0.781946
왜 이래요? 새삼스럽게. ,Why equal this like this new,0.651643,0.683929,0.732910
고발이 들어와서 우리도 좀 그래. 며칠만 들어갔다 와. ,The charge follow in so we are Went in a few Clarence Day,0.519338,0.557595,0.791172
나 이대 나온 여자야. 어떻게 그런 델 들어가. ,Im a cleaning woman from here How to catch into that dingle,0.557737,0.678683,0.769041
정마담! 좀 봐줘. 우리도 힘든거 알잖아? ,Jung gentlewoman facial expression at me You jazz its concentrated right hand,0.489044,0.542927,0.846702
"한마디로 나 고광렬이가 우리 동생 깡다구에 반했다 이거야. 내가 왜 보디가드가 필요하냐? 나로 말할 것 같으면, 음.. 정체를 드러내면 안되는데.. ",In a Logos I be shell by Kwangryul Ko my chum Why answer I postulate a bodyguard If you think Im going to distinguish you um you shouldnt let out your individuality,0.592343,0.607296,0.787743
정체가 뭔데요?,What be your personal identity,0.572991,0.579145,0.841411
"아우만 알고 있게, 나는 타짜야. ",but my blood brother have intercourse Im Tajja,0.475301,0.560359,0.764713
뭐요? ,what,0.396358,0.625843,0.695812
타짜..타짜! ... 타짜라고! 쉿~.. 내가 옛날에는 호텔에서 치던 사람이야. 제벌 2세들하고. 그땐 좋았다. 걔네들은 돈도 품위 있게 잃어준다. ,Taj Taj Tajja I used to meet at a hotel in the old days With the second multiplication It represent good then They lose money right,0.619749,0.687772,0.794115
.... 일단 내 돈 1000만원부터 갚으면.,one time I compensate backwards my money from 10 million gain,0.631617,0.609439,0.763604
무슨 천만원? ,What 10 million win,0.573450,0.656825,0.774469
아까 판. 내가 땄으니까. ,Previous interpretation Because I check,0.471455,0.610619,0.783409
에이~ 내가 패를 안깠는데. 지금 다시 칠까? 응? 좋아~ 두말하기 없기야.  천만원짜리 판이네. 자! 내꺼부터 까면 3땡이잖아. 넌 아마 1땡일거야. ,A I didnt dally Shall we off it over again instantly Huh Okay I experience naught to tell Its a 10 million advance interpretation graphic symbol If you hack it from mine its 3 dot Youre probably one,0.624909,0.636967,0.764257
1땡 줬는데..  너.. 너도 타짜냐? ,I contribute you one are you are you a slugger too,0.551354,0.555963,0.754495
천만원 줘야지 ,10 million acquire,0.485786,0.526823,0.814005
이건 무효야. ,This cost invalid,0.505078,0.525757,0.720857
3번 말이 선착이야. 볼 것도 없어. ,gymnastic horse identification number three is firstcome There is null to image,0.482082,0.655442,0.839302
8번 갔지? ,Eight multiplication,0.660717,0.746497,0.700278
3번이래매. ,Its identification number three,0.507170,0.712799,0.830556
"에이 8번이랬지. 생각해봤는데, 나의 신비한 기술에 너의 깡다구를 합치면 우리는 걸어다니는 중소기업인거 같애. 팔도를 유람하면서 호구 뺏겨먹고 타짜들도 뺏겨먹고 여자도 뺏겨먹고..크큭.. 왠지 너랑은 간이 좀 맞을 거 같다. ",It equal Eight Ive be consider about it and if you combine your whodunit with mysterious skill we seem to cost walk small business organization As I cruise around Faldo I eat the hukou the other striker the char and I imagine its get going to embody a small routine considerably with you,0.586036,0.642871,0.773052
관심없대니까.,Im not interested,0.709567,0.672092,0.713562
야! 인생? 네트워크야! ,Hey life history Its a meshing,0.523107,0.659237,0.729498
타짜들은 만나다보면 아귀도 만날 수 있습니까? ,If you touch the Tajja can you take on the fiend,0.514617,0.648317,0.811891
무척 재수 없으면. ,Without fate,0.425541,0.735573,0.847630
걱정 많이 했구나? 곧 나갈거야. ,Are you worry Im choke out soon,0.338105,0.573527,0.835004
나 서울이야. ,Im Seoul,0.429160,0.509801,0.787833
서울? ,Seoul,0.426919,0.666337,0.568624
세상구경도 하고.. 아귀도 찾고. ,go to the Earth and expect for an angler,0.638805,0.638805,0.719622
"왜 그래 애처럼. 아귀가 그랬다는 증거도 없고, 아귀랑 붙어서 이길 수도 없어. ",Why like a shaver There equal no grounds that the ogre answer it and you tilt make headway by stay with it,0.593232,0.647258,0.759889
이거 왜이래? 패는 까봐야 알지. ,Why represent this You bonk how to fall behind,0.524545,0.619225,0.768545
내 말 들어. 이겼다 쳐. 유명해지겠지. 그럼 누가 자기랑 붙겠어? 뭐하고 살건데? ,take heed to me Beat it It will go famous so who will cling with you What are you pass away to go with,0.609681,0.611267,0.793101
시골에서 주유소나 하지 뭐. 착하게. 결혼도 하고. ,I dont dress gas post in the countryside commodity Im draw get married,0.540256,0.616106,0.787293
그럼 나랑은 아닌거네. ,and so its not with me,0.589435,0.680815,0.807207
정마담! 혹시 나 사랑해? ,Jung gentlewoman Do you jazz me,0.594629,0.655154,0.771305
......... 넌 내 식구야. 또 볼건데. 잘 갔다 와. ,You constitute my kin complaint encounter you once again I break down considerably,0.473604,0.627761,0.850837
야이 쐉년! 빽 좋나보다. 빵에서 전화질도 하고. 누군 왕년에 사랑 안해봤나? 개폼 잡지 말고 빨리 안찌그러져? 뭘 야려? ,Yay kick Better than that Im call from shekels Who havent you bonk in the past Dont you perturb me quick alternatively of a domestic dog configuration magazine publisher What do you need,0.554447,0.619789,0.760937
니가 사랑이 뭔지 아니? ,execute you bonk what sexual love embody,0.460746,0.611132,0.836686
넘어졌대요. ,She fall,0.485424,0.614866,0.758737
나중에.. 먼 나중에 알았어요. 고니를 서울로 보내는 게 아니었는데... 그랬다면 우리가 좀 더 행복했을까? ,subsequently I knew subsequently I wasnt send Connie to Seoul but would we experience equal happy,0.572924,0.632608,0.783489
일어나. 내가 니가 미워서 그러는 게 아니다. ,ignite up Its not because I detest you,0.691286,0.735735,0.794093
네. ,Yes,0.701027,0.952860,0.589453
예. 어.. 어.. 가서 그래. 나 못 기다리니까 직접 해결하라고... 오늘 뭐?.. 별거 아냐 얼마 안 잃었어.... 망신은 무슨.. 그래 끊어. ,Yes Uh Uh conk there I pitch wait to lick it myself What cost you practice today Its no big business deal I scarce lost a small What execute you think,0.646407,0.644191,0.744484
이게 웬 망신이야. 소문 다 나고 휴!! 다시 엎드려.  너때메  내가  뭐가되냐? 휴!! 화란이 집에 가서 술이나 한잔 하자. ,This constitute a shame Its all rumored and Hugh Get downwardly once more What make up I last to be when you be Phew net ball conk dwelling house and feature a drinkable,0.526410,0.595545,0.774141
단속 나왔나봐요. 12시 영업때메.,I mean its crackdown At 12 oclock,0.491007,0.633283,0.827328
이놈의 나라는 왜 12시가 넘으면 술을 못먹게 해? ,Why execute this rural area halt drink after 12 oclock,0.575871,0.642461,0.759587
누구세요?,Who,0.319722,0.469233,0.867007
회장님 모시고 왔습니다.,I give a chair,0.357056,0.564630,0.886365
"화란이 불러오고, 술 한상 내와. ",Hwaran be do and Im in the mood for a drunkenness,0.468569,0.630745,0.786043
예? ,Yes,0.701027,0.952860,0.693569
너 오랜다.  단속 아니에요. 가서 드시면 되요. ,You constitute long Its not crackdown You can get and experience it,0.605832,0.652752,0.819837
쉿! ,Shh,0.358579,0.587868,0.694253
어떻게 언니는 저런 인간한테 돈을 빌려가지고는. ,How practice she take up money from a human like that,0.556004,0.651108,0.751345
더 예뻐진 것 같다. 앉어.,It seem to be prettier Sit down,0.649108,0.649108,0.733005
용건만 말씀하세요. ,Please say me but the thing,0.529742,0.603512,0.789583
너는 내가 빌려준 돈 때문에 너를 괴롭힌다고 생각하냐? ,make out you recollect youre inconvenience oneself you for the money I add you,0.648746,0.648746,0.757127
빚은 갚을 거예요. ,I will make up the debt,0.569205,0.583185,0.667093
안갚어도 돼! ,You dont get to pay off back,0.479434,0.619471,0.771386
화란씨 오늘 우리 회장님이 이상한 놈들 두놈한테 상처 받으셔서.. 알잖아요 우리 회장님 소년같으시고.. 앉으세요. ,Mr Hwaran Today our chair constitute injure by two weird guy You know see like our chair boy Please sit down,0.467246,0.581043,0.841249
깡패도 상처 받나요? ,do the bully go ache,0.510437,0.584469,0.790780
"무석아! 나가서 노래하나 해라. 어, 니가 날 깡패라고 생각했구나. 나 깡패 아니다. 그냥 젊었을 때 잠깐 건달생활 했던 것. 그걸로 덕 보고 사는 건데 화란아 내가.. 뭐 이런 얘기하면 그렇지만.. 허허 천하의 곽철용이도 적금을 붓고 살고 그런다. ",howler disco biscuit out and talk a call Uh you think I follow a bully I am not a bully I just experience for a while when I represent young I go by sexual morality of it but when I talk about something like this but Heoheo Kwakcheolyong of the human beings also teem red Au,0.572117,0.647229,0.783867
형님 진짜 적금 붓습니까? ,come you genuinely pelt red gold,0.608494,0.593244,0.773991
화란아 나도 순정이 있다. 그런데 그 순정이 짓밟히면 그때는 깡패가 되는 거야. 니가 날 깡패로 만들래? 내가 납치라도 할까 너를? ,Hwaranah Im pure notwithstanding if the sexual morality be tread then you will be a goon Would you shit me a bully Should I snatch you,0.574040,0.624646,0.811659
얘기 끝났으면 가볼게요.,complaint get when Im do peach,0.736652,0.659191,0.762611
어딜 가? ,Where cost you get going,0.313132,0.646021,0.888587
아이 단속나온 줄 알았네. ,I call back the child cost break through down,0.516446,0.592217,0.775143
니들이 여긴 왜 왔어?,Why equal you hither,0.514839,0.605273,0.783778
돈 땄으니까 술한잔 해야지. ,Ive go a drink so I have got to drink,0.563960,0.563960,0.761948
이 스무장 세계 좁다. 튀지 마라. ,This twentyarmed populace make up narrow-minded bash not squelch,0.465776,0.566895,0.855525
돈 따야지 왜 튑니까? 아 화란씨 북한산 말야 싫으면 영화나 한편 봅시다. ‘장미빛 인생’하던데 최재성 나오는 거. 내일...  노래 계속 해. 갑시다. ,Why should I bring forth yield Ah Mr Hwaran if you dont like it allow catch a film Rosy lifetime but Choi Jaesung get out Tomorrow sustenance sing net ball sound,0.557031,0.646804,0.789296
진짜 이상한 사람이네요. ,helium a real foreign soul,0.550429,0.619674,0.738678
세상에 안이상한 사람도 있어? ,represent there any unusual individual in the worldly concern,0.473126,0.637053,0.848692
영화 보기로 했어? ,Are you think to determine a moving picture,0.374859,0.490573,0.811981
세게 나오네. ,It do out concentrated,0.393379,0.694815,0.831695
맘 있구나?,execute you own a substance,0.441467,0.583110,0.841051
미쳤어? ,Crazy,0.482728,0.691004,0.800871
다시하면 이길 수 있겠냐? 걔가 너보다 사이즈가 웃질 아냐? ,Can you succeed once more Isnt she the size laugher than you,0.616781,0.670576,0.794732
이길 수 있습니다. ,To win,0.358144,0.633216,0.879885
또 지면 너는 변사체가 된다. ,If you lose once again you go a metamorph,0.570067,0.570067,0.725242
예. ,Yes,0.701027,0.952860,0.693569
담엔 나도 낀다.,I tire out it on the bulwark,0.518898,0.656625,0.745438
화란이 파트너는 나야. ,Hwaran constitute my married person,0.590258,0.643346,0.770329
나 안해. 순 지맘이야. ,I dont Its pure simam,0.578010,0.578010,0.715644
난 그냥 담주에 강남 아줌마들 모이는데 가서 재미있게 놀고 인천으로 뜰거야. ,Im just now garner Gangnam aunts in Damju Im conk to induce sport and go to Inchon,0.582397,0.644664,0.789174
형님은 아줌마랑 어울린다. ,My chum cling out with my aunt,0.592960,0.631294,0.801008
"아줌마들이 더 깔끔해. 솔직히 걔네들 자고나면 땅값 오르고 아파트값 오르니까 1,2억 대가리 맞아봤자 피도 안나요. 우리야 뭐 기분 적당히 맞춰주고 스트레스 풀게 해주고 착하게 사는거야. ",The lady equal cleaner frankly when they kip the kingdom monetary value climb and the apartment monetary value heighten We involve to be in good mood ease emphasis and be nice,0.522734,0.628797,0.824558
내가 곽철용한테 얼마나 딸 거 같애? ,How much answer you think I will commence to Kwak Cheolyong,0.607601,0.604530,0.740312
몰라. 안들려. ,manage not have intercourse I can not see you,0.460076,0.611493,0.871773
20억은 따야겠지? ,Should I win 2 billion,0.624827,0.745413,0.780503
안들린대니까... 20억? 옛날에 우리 할머니가 점보고 오셔갖구 내가 한재산 모을 팔자라구 그랬는데..,I tilt hear you 2 billion In the old day my nan issue forth to the computer storage and tell me to deal Hanjae,0.546141,0.668861,0.810880
나때메 그런거지. ,Its like that,0.546808,0.787009,0.797361
왔다. 와 차 좋네.,make out Wow thats nice,0.686207,0.686207,0.816102
훔친 거 아냐 저거? ,Isnt that steal,0.599252,0.705809,0.734425
언니! 우린 지금 쟤네 단골 만들려고 하는 거지 데이트하는 거 아냐. ,baby Were adjudicate to pull in them regular not go out,0.508303,0.644616,0.831972
어 알았어. ,Okay,0.413136,0.664517,0.774605
그리고 애 있다는 얘기 하지 마. ,And dont tell apart me youre a small fry,0.642751,0.679431,0.744837
어떡하지? 나 그 얘기부터 할 거 같은데.,What do we do I mean Ill embark on with that,0.601746,0.598494,0.747773
그런 건 거짓말해도 괜찮아. ,Its okay to lie like that,0.548513,0.670665,0.852415
오늘 매상은 책임져야 되요.,You experience to cost responsible for sales agreement today,0.412745,0.640056,0.854412
오케이. ,okey,0.784376,0.893096,0.782275
영화 재미없다. 아~ 화란씨 집구경이나 합시다. ,moving picture equal not fun Ah LET choke check Mr Hwarans sign,0.509505,0.593844,0.772533
고니씨 바람둥이죠? ,exist Connie a tease,0.623297,0.645556,0.782399
당연하지. ,Of path,0.405126,0.528345,0.763057
"저... 먼저 말씀 드릴 게 있는데, ",I I consume to distinguish you foremost,0.585122,0.588907,0.727024
뭐요? ,what,0.396358,0.625843,0.695812
저 애가 하나 있어요.,I experience a kid,0.658042,0.670934,0.720264
애? 몇 살? ,Ah how old,0.534664,0.563022,0.758613
다섯 살요. ,Im five old age old,0.620353,0.514445,0.748413
애 아빠는? ,Your don,0.516111,0.630752,0.747878
죽었어요. 너무 힘들어서 버릴까도 생각했었는데... ,Dead I thought it would be also hard to discombobulate it off,0.603123,0.629302,0.768307
버리면 안되지. 애를. 애를 버리면. 어떻게 되냐면. 나같이 돼요. 응? ,You pitch shed it off Thomas Kyd If you discombobulate out your small fry What occur Become like me Huh,0.536813,0.641237,0.751719
그래서 안버리고 잘 키워요. ,So I dont discombobulate it off and grow well,0.499614,0.627413,0.782849
잘했어요. 세란씨 훌륭해.  뽀뽀 한번 할까요?,Well arrange Seran is great Shall we kiss,0.481181,0.587667,0.838844
예? ,Yes,0.701027,0.952860,0.693569
외로운 사람끼리. ,Lonely mass,0.395270,0.734225,0.780430
우리도 나가지. ,We belong out likewise,0.585149,0.642321,0.764368
왜요?,why,0.548993,0.585731,0.593658
영화보러 온 것 아닌거 같은데. ,I dont guess I get to the motion picture,0.520714,0.576317,0.757038
하! 난 영화 재미있어요. ,Ha Im own play with the pic,0.643967,0.601339,0.759450
빚이 얼마야? ,How much is the debt,0.592867,0.660185,0.735607
많아요. ,many,0.558298,0.658553,0.649098
내가 대신 갚아줄께. ,I will give you back,0.517910,0.683782,0.805875
왜요? ,why,0.548993,0.585731,0.593658
그러고 싶어서. ,I require to,0.447675,0.576693,0.770412
지금 뭐하시는 거예요? ,What cost you do at present,0.577507,0.582857,0.771286
일종의 배팅이지. ,Its a variety of betting,0.642832,0.683323,0.748031
내가 사람 잘못 봤네요. 사랑이 뭔지나 아세요? ,I pick up the wrong individual Do you have intercourse what sexual love is,0.481474,0.586610,0.766561
사랑? 어차피 사랑도 다 구라 아냐?  이게 중요한거지. ,sexual love Isnt it all be intimate anyways This constitute crucial,0.564539,0.636288,0.771093
고니씨? 당신이나 곽사장이나 똑같은 남자네요. ,Connie You and Kwak Kwak cost the like piece,0.531022,0.675416,0.843324
뭐가 이렇게 복잡해... 망할 년. 이쁘긴 왜 저렇게 이쁜거야. ,Whats and so complicate damn cunt Why exist it therefore jolly,0.632850,0.638820,0.753161
이러면 안돼요.,You pitch act this,0.502250,0.676092,0.759857
이러면 안되지. 알아 알아.,You pitch do this I be intimate I be intimate,0.440156,0.639094,0.803625
잠깐만요. ,waiting,0.328138,0.559905,0.899701
응 잠깐만 할게. ,Yes Ill moderate on,0.601319,0.552381,0.814959
진짜 안돼요. 도박하는 사람인 줄 몰랐어요 나는. ,I real pitch I didnt know I constitute a risk individual,0.558352,0.591790,0.762344
끊을거야. ,Im choke to cling up,0.456449,0.656452,0.750450
진짜요? ,real,0.513420,0.526083,0.816102
진짜래니까. ,Its real,0.496980,0.705838,0.786216
화란인가봐요. 숨어요. ,I mean its angry pelt it,0.534816,0.620171,0.783738
데이트는? ,Date,0.554637,0.964645,0.847126
차버렸어. 언니는?,Its kick sis,0.522650,0.735963,0.772876
나? 그냥 헤어졌지. ,I I just now go up,0.547820,0.574927,0.765176
잘했어. 솔직히 그 사람 헤어스타일 못봐주겠드라. 지 머리 사랑할 줄 모르는 사람이 여자를 사랑하겠어? ,Well act Honestly I cant see his hairdo testament somebody who doesnt be intimate whisker have intercourse a girl,0.541555,0.631727,0.792904
넌 근데 왜 찼어? ,Why represent you complain,0.418939,0.666123,0.762005
"너무 들이대고 너무 저질이고, 지가 멋있는 줄 알고 암튼 그래. ",Its too intoxicating its too poor and I have intercourse its cool,0.587497,0.672360,0.794433
너 그 사람 멋있어서 좋대매. ,You wish him because he be cool,0.639717,0.668287,0.759097
내가 언제?,When dress I,0.554450,0.554450,0.670531
어제 저녁에 나한테 그랬잖아. ,You get along it to me last night,0.727069,0.668678,0.786868
어제 저녁까진 그랬지. 내 요 머릿속에서는. 언니 그 인간들 화투치는 사람들이래. ,Until yesterday eve In my idea My sis embody citizenry who cost shin,0.562942,0.694800,0.826778
그으래? 끊을 수도 있잖아. ,genuinely You can fall up,0.785174,0.785174,0.712584
진짜 멋있는 놈이면 끊겠지. ,If youre a real cool cat Ill quit,0.510270,0.681366,0.796222
아빠? ,Dad,0.484082,0.484082,0.688136
응? 아저씨? 자자 자자. 아저씨는 누구냐면.. ,Huh Mister Lets eternal rest Who is you,0.500828,0.570570,0.791374
아빠?,Dad,0.484082,0.484082,0.688136
쉿!.. 응 그래 아빠야. ,Shhh Yeah its dada,0.640283,0.735186,0.794712
아빠~ ,Dad,0.484082,0.484082,0.688136
엄마! 아빠 왔어. ,ma pa embody hither,0.439694,0.460403,0.809922
어디? ,where,0.426984,0.426984,0.498452
어디로 모실까? ,Where execute you need to belong,0.401752,0.600122,0.832684
전주요. ,Jeonju,0.500785,0.628051,0.641390
전주? 전주에는 뭔일로 가시나? ,Jeonju What cost you go to in Jeonju,0.625632,0.595399,0.800451
.... ,,1.000000,1.000000,1.000000
근데 전주까지 요금이 꽤 나올텐데... 학교서 막 나와서 돈도 없을거고... 내가 기분 한번 내고 확 공짜로 해줘? 응?,But the fare will be quite a reasonable until Jeonju I but experience out of schoolhouse and I wont make any money Huh,0.539026,0.627443,0.791414
아버지가 일제시대때 탄광으로 큰돈을 벌었고 당시만해도 전주 군산 이리에서는 이집땅 안밟고 못 지나갔는데.. 아들 셋이 다 말아먹고 자빠졌다가 80년대 후반에 부동산하고 사체로 꽤 모아서 집안을 일으켰죠. ,My don garner a bunch of money from a coal mine in the Japanese colonial era and at that time I couldnt hold out through this office in Iri Gunsan Jeonju All three of my son go to bottom and diminish asleep,0.548647,0.604811,0.822342
아들 셋이 뭘로 자빠졌대?,What perform your three sons sleep with,0.567494,0.548642,0.703079
도박이죠. ,Its gaming,0.563854,0.640205,0.734770
어이 아가씨! 어이,Hey gentlewoman Hey,0.473664,0.614355,0.731694
저요? ,Maine,0.736926,0.628104,0.528862
이거 이거 ,this this,0.744772,0.744772,0.618699
어머 죄송해요. 제가 그랬나요? ,Im sorry Did I,0.403706,0.648598,0.857187
닦아서 지워져 그게?,Wipe it off,0.300234,0.530457,0.839244
됐어 이사람. 좋게 운동하고. ,Thats it shape out nicely,0.496292,0.630071,0.805043
죄송해서 어떡해요?,Sorry what,0.311850,0.631027,0.805958
"비싼건데, 버리죠 뭐. ",Its expensive but discombobulate it by,0.483410,0.547800,0.803809
거 참.. 애 죽이네. ,Its actually its kill her,0.605130,0.685408,0.796929
계속해. ,continue,0.650598,0.658347,0.769270
"자존심 세구, 호탕하고, 스포츠 광이고, 나이는 쉰둘인데 사십대 초반으로 보인다고 하면 좋아합니다. ",Im proud to articulate that Im a selfrespecting enthusiastic mutation enthusiast and fiftytwoyearold in his early forty,0.578285,0.592162,0.752328
나랑 몇 살 차이 안나보여요. ,I dont watch how old I follow,0.488931,0.595169,0.794058
"솔직히 내가 오까네 빼면 시첸데, 어느날, 날씨 좋은 날, 하늘을 보는데 야~ 아름답드만. 오래 살아야 되겠다~ 내가 돈 쌓아놓고 일찍 죽으면 뭐하나... 그때부터 안해본 운동이 없어. 테니스 수영 골프. 골프 잘 쳐요?",frankly except Im get its Shichende unity Clarence Day a good daylight and count at the sky I own to experience for a long time What dress I do if I stack up money and die early I havent own a physical exertion since then Tennis swimming golf game Are you good at golf,0.660298,0.653268,0.754674
아뇨 아직 100타 못 깨요. ,No I havent gotten 100 snapshot notwithstanding,0.484434,0.617180,0.810150
보기플레이까진 가야되는데. 선생을 잘 못 만나셨구만. ,I own to fit until the bid You didnt match the teacher well,0.597424,0.663221,0.814137
사장님! 골프는 언제 그렇게 쳤어요? 오늘 또 거덜나네. ,knob When did you wager golf Im sick once more today,0.527228,0.642422,0.798315
요새 화투치러 다닌대메. 거기서 만회해. ,He become to fortification shuffling up there,0.639732,0.584395,0.766553
자기 요새 화투도 쳐요?,Are you struggle with your own fortress,0.384728,0.577905,0.787337
그냥 두어 번 쳤어. ,I just now impinge on it a match of multiplication,0.455874,0.665781,0.832429
재수씨! 도박 좋아하는 인간치고 돈 못 버는 놈 없어. ,Jaesu There cost no one who pitch throw money with gamblingloving human organism,0.517754,0.579880,0.767231
