Original(Korean),Basic Translation(google trans),comp1 score,comp2 score,comp3 score
제가 구라가 되겠어요? 자연빵으로 쳐야지요. ,Will I cost Gura You should shell it with natural dough,0.654655,0.646137,0.786129
자연빵은 자신있다? ,Are you confident in natural dough,0.617070,0.645058,0.774556
운이지요. ,Lucky,0.452810,0.640559,0.710114
아직도 노름판에서 운을 찾냐? 선을 가리자. 밤일낮장. ,Are you notwithstanding see for chance on the take chances instrument panel natural covering the stock Day and dark,0.551411,0.676080,0.825758
우리때는 누가 들을까봐 손가락 깨물면서 했는데 저것들은 꼭 들으라고 그러는 것 같다. ,We use to prick our digit in cause we see soul but it look like they must listen,0.525415,0.666143,0.831956
백만원! ,one million win,0.606933,0.598335,0.819158
한판에 끝내실려구요? ,Do you want to cease it in one bout,0.595123,0.634924,0.773071
겁나면 죽던가.,If youre dash die,0.485742,0.620511,0.793408
좋아요. 백만원. ,good one million win,0.446091,0.564601,0.812017
장땡인가? ,be it long,0.611997,0.717561,0.775655
예. ,Yes,0.701027,0.952860,0.693569
니미 9땡이네. ,Its Nimi 9,0.671324,0.684226,0.808495
너 니가 잃었다는 돈 복구하면 화투 끊을 수 있겠냐? ,Can you discontinue push if you regain the money you lost,0.619927,0.640072,0.791854
...다섯배는 벌어야죠. ,You must gain five clip,0.654505,0.685151,0.729739
못 끊으면 손가락이라도 자르는 거다. ,If you pitch quit youre thin out your fingers,0.519612,0.576018,0.797746
예. ,Yes,0.701027,0.952860,0.693569
좋아  평경장입니다.... 허허.. 부산에서 봅시다. ,Okay its Pyeonggyeongjang net ball see it in Busan,0.583862,0.683006,0.775140
누굽니까? ,Who cost you,0.645601,0.645548,0.730284
너! 도박의 꽃이 누군줄 아냐?,you cause you bonk who the play blossom embody,0.523238,0.540309,0.756855
기다리라 그래. ,delay,0.428328,0.853124,0.884349
오랜만이에요. ,Its be a piece,0.549855,0.639716,0.801109
음.. ,considerably,0.288415,0.714264,0.908111
일 얘기부터 할까요? 오장군이라고 별 두개로 퇴역했는데 돈도 많고 진짜 노름꾼이에요. 기술은 없어도 빠꼼이고. ,Shall we peach about thing first off I withdraw with two star topology name O Janggun but I stimulate a passel of money and Im a real risk taker Without skills its fast,0.558037,0.598942,0.764175
그러니까 나같은 타짜가 필요하다? ,So you need a striker like me,0.470818,0.598342,0.799677
보고싶기도 했고. ,I missed you,0.414718,0.539509,0.839129
허허.. 구라가 늘었네. ,Heohe Gura feature increase,0.637445,0.711293,0.768224
누구예요? 보디가드? ,Who follow you bodyguard,0.744157,0.744157,0.777948
"고니라고, 내일 선수로 뛸거야. 나는 바람이나 잡고. ",Goni Im last to toy as a instrumentalist tomorrow I check the confidential information,0.549943,0.608029,0.800484
그렇게 실력이 좋아요?,Are you so good,0.443635,0.477687,0.857720
탈이 좋잖아. ,I wish the ride,0.611904,0.628710,0.766404
그냥 젠틀해 보이는데. ,It just now search gentle,0.519119,0.744736,0.770076
젠틀은 니미. 나하고 실화를 치자고 해놓고 말 떨어지기가 무섭게 나한테 밑장 빼더니 9땡을 주더라구. ,Gentle constitute Niimi He call for me to bet a true floor and he pock me off and commit me 9 Transportation,0.570254,0.647734,0.803391
9땡 준걸 알고 계셨습니까? ,Did you have intercourse you yield me 9,0.658219,0.666388,0.776819
이놈아! 밑장을 빼면 소리가 달라! 소리가! ,Hey The auditory sensation is unlike when the buttocks is take out auditory sensation,0.570395,0.669762,0.818046
에이 사람을 들었다 놨다 하시는구만. ,Youve heard and allow die of this soul,0.464776,0.671840,0.801966
눈썰미 좀 볼까? 이 방안에 의자가 몇 개 있을까?,Shall we seem at the snow How many chairperson constitute in this way,0.546632,0.618771,0.748591
의자? ... 여덟 개,professorship eight,0.517059,0.585523,0.656325
다섯갠데.,Five,0.320014,0.640719,0.788841
저쪽에 안쓰는 의자가 세 개까지. ,Up to three unused electric chair over there,0.604960,0.612626,0.766909
나는 어떤 사람 같아요? ,Who make out you conceive I personify,0.529337,0.570483,0.731354
화투는 못 칠 것 같은데요. ,I dont mean I can off,0.401646,0.643021,0.846218
어떻게 알아? ,How practice you be intimate,0.353006,0.560896,0.867449
손이 부드러우니까. ,Because my deal cost soft,0.590535,0.601108,0.724485
그리고 또?,And once more,0.578640,0.666423,0.736425
외롭고.,Lonely,0.444443,0.523510,0.695248
호호. 잘 아네.,Ho Ho I sleep together considerably,0.443467,0.578995,0.869274
타짜니까. ,Its hot,0.556024,0.507566,0.737054
어떻게 지내셨어요? ,How stimulate you been late,0.613660,0.638811,0.722000
내 인생은 뭐랄까.. 외로운 돛단배 같다고나 할까. 아티스트적 개념으로다 사니까 우리는. 그래서 나 미워해?,What would my life be like would it be like a lonely sailboat Because we know by creative person construct we constitute So you hate me,0.622882,0.620762,0.762211
예. 미워하죠. ,Yes I hate you,0.534503,0.555424,0.807812
허허.. 내가 코를 비비면? ,Heohe What if I itch my olfactory organ,0.537303,0.628844,0.747704
무조건 죽어라! ,dice unconditionally,0.476420,0.612033,0.782418
입술을 만지면? ,touch the sass,0.472148,0.650401,0.800277
판돈을 키워라!,call down money,0.647894,0.612031,0.801223
어깨를 주무르면?,When you sustain a berm,0.521952,0.522105,0.723111
어깨는 1. 배는 2. 무릎은 3. 입술을 깨물면 4. 한숨 쉬면 5. ,Shoulders 1 belly 2 stifle 3 bite back talk 4 sigh 5,0.411585,0.618179,0.847773
정마담이랑 친했어요? ,Are you close to Jung ma'am,0.555606,0.543205,0.794667
나한테 좀 재밌었던 적이 있었지. 아~ 꽃 좋다. 너 저게 뭘로 보이냐? ,It follow a short fun for me Ah bloom constitute good What perform you picture that,0.597292,0.592120,0.739003
화투짝 3요.,3,0.000000,0.000000,0.000000
너도 이제 슬슬 미쳐가는구나. ,You constitute proceed crazy too,0.691511,0.665691,0.755558
약주 한 잔 안하세요?,Dont you stimulate a swallow,0.622947,0.657031,0.797039
마시고 들어와라. ,boozing and fall in,0.706730,0.720072,0.669718
누구냐? ,Who cost it,0.632225,0.648324,0.782743
어허~  인생 참 꽃 같애. 니미. ,Uh huh life history equal like a flower Nimi,0.586244,0.649905,0.792703
생각보다 늦게 왔네. ,I do later than I recall,0.520748,0.608182,0.760354
그게 아니라 양복을 놓고 가서. ,Its not like that,0.543946,0.700747,0.862724
그래? 양복.. ,okay wooing,0.482951,0.513519,0.792280
안갔어? ,Didnt you run short,0.455264,0.620974,0.889114
술 한잔 합시다. ,net ball have got a drink,0.597264,0.565502,0.759059
그렇게 막 하는게 아냐.  이렇게.. 이렇게. 어때? ,Its not like that Like this like this What practice you consider,0.646184,0.682028,0.747818
축축한 꽃 같애. ,It wait like a dampness flower,0.471041,0.604648,0.746732
그래.. 이렇게. 착하네. ,Yes like this Good,0.700773,0.799967,0.740387
에잇. 남자를 어떻게 보고. ,Eight How to ensure a gentleman's gentleman,0.483870,0.607064,0.820605
평경장? 웬만하면 기억에서 지우고 싶다. ,Pyeongjangjang I need to score out it from computer memory,0.618632,0.638605,0.744511
둘이 같이 잔적도 있었겠네? ,The two of you might cause follow together,0.598468,0.614331,0.711456
호호.. 웃겨. 자기 돈벌고 싶지? ,Hoho funny brawl you want to stool your own money,0.577690,0.608195,0.826479
벌고 싶지. ,I want to earn,0.396811,0.531977,0.704038
나랑 같이 일하면 재미 좀 있을거야. ,It will live fun if you lick with me,0.468940,0.630762,0.808050
평경장님은? ,Pyeonggyeongjang,0.569148,0.657945,0.784066
길거리 인생이야. 옛날에야 잘 나갔지. 그럼 뭐해? 지금 개털인데. 나랑 일하면 BMW 탄다. ,Street life sentence It conk substantially long ago Then what make up you do Its domestic dog whisker flop now If you operate with me you turn on a BMW,0.584733,0.648539,0.788454
BMW라... 그게.. 뭔데? ,BMW what represent it,0.384958,0.643335,0.814127
호호.. 그럼 에르메스는 알아? ,Hoho So what about Hermes,0.560862,0.625105,0.739136
어~ 무거운데. ,Uh its heavy,0.452415,0.576390,0.684409
내일 잘 할 수 있어? ,Can you execute considerably tomorrow,0.538498,0.581742,0.867653
내 수칙! 상대를 흥분시켜라. 흐흐 ,My confidential information Excite your opposition Heh,0.555822,0.615850,0.759746
천 더. ,A thousand more than,0.424374,0.696794,0.835142
잘 들 치세요. ,Listen cautiously,0.750155,0.750155,0.717081
다 받아. 1땡! ,subscribe to it all 1 ding,0.525420,0.631836,0.806718
1땡 뒈지시고.. 3땡! 아이고 감사합니다. ,One fall three Thank you,0.416345,0.565176,0.879850
이놈이 애미애비도 없나? 자네 지금 뭐라고 그랬나? ,Doesnt this cat throw an abby What execute you pronounce now,0.589938,0.649811,0.746160
왜 그러세요? ,Why act you act that,0.659577,0.717383,0.720193
방금 나보고 뒈지라고 그러지 않았어 자네가? ,Didnt you just now say me to arouse up,0.481725,0.626891,0.826658
누가 장군님 뒈지라고 그랬나요? 1땡 뒈지라고 그랬지. ,Who assure you to hold back superior general I say you to lose it,0.530805,0.593903,0.798023
그 말이 그 말 아냐 이놈아? ,Isnt that what you think,0.615365,0.626146,0.730007
이놈 저놈 하지 맙시다. 에 드러워서 이거 어디 상전 모시고 노름하겠나? 어이 거기 아저씨 우리 맥주 좀 빨면서 합시다. ,net ball not arrange that one Where would you conk out and chance with this Hey there allow soak up our beer,0.511591,0.607923,0.839849
노래 부르지 마! ,Dont sing,0.533834,0.581841,0.840668
왜요? ,why,0.548993,0.585731,0.593658
신경쓰여. ,I wish,0.370612,0.575781,0.867954
에이 뭐 이렇게 하지 말라는 게 많아. 박정희야 전두환이야.  ,A circumstances of hoi polloi dont act this Its Park Jeonghee,0.554554,0.580568,0.755082
"8은 안좋다. 족보도 안만들어지고, 잘해야 8끗. 하지만 또 8이 나오면.. 안돼. 가면 안되는데... ",8 constitute regretful No family tree was make and at well it was 8 clean But when 8 get out again no I tilt go,0.605757,0.650027,0.798927
8천,8000,0.000000,0.000000,0.000000
두 번째 패도 안보고? ,Didnt you picture the second paw,0.469816,0.603684,0.751659
그냥 기분이. 머리에 총 맞았으면 따라오시고. 장군님 앞에서 머리에 총 맞았다고 하면 실롄데. 시정하겠습니다 장군님.,just now experience If you buzz off snap in the head watch me If you tell you personify blast in the head in front line of the general its Sillian I will set you General,0.606383,0.640319,0.757653
좋아. 넌 내가 잡는다. ,Good You catch me,0.410638,0.615376,0.814768
음... 이천 모자라는데.. 이거 받아줄 수 있나.. ,Um I dont take enough john you assume this,0.513310,0.631957,0.819716
실탄은 저기 있고. 괜찮나? ,Theres a slug Are you okay,0.480091,0.661136,0.786997
받아줍시다. 까짓거. ,Please assume finish up,0.599946,0.557933,0.762790
7땡.,7 ding,0.565685,0.900000,0.811416
와! 후~ ,Wow Whoo,0.900000,0.900000,0.882870
장군님 오늘은 끝난것 같네요. ,superior general I call back today is over,0.600392,0.627623,0.730818
잠시 대기! 자네  내 가게 금고에 가서 돈 좀 꺼내와. 10분만 기다립시다. ,Wait a present moment disco biscuit to the prophylactic in my computer storage and come some money let await just 10 min,0.480768,0.635077,0.813771
"그때, 고니에 대한 내 감정이 뭔지 알았어요. 사랑? 뭐.. 그런 것까지 포함해서.. 가지고 싶다! 저 인간을 가지고 싶다... 나갔던 사내는 3분만에 돌아왔어요. 약속된 거였으니까.",At that fourth dimension I experience what my tactile sensation follow for Connie have intercourse Well include that I want to throw it I want to throw that human The gentleman's gentleman who run short out come back in 3 mo It cost call,0.584349,0.618939,0.760784
소리내면 죽는다. 손구락도 까딱허지 마! ,If you get a speech sound you go Dont check your fingers,0.640345,0.607060,0.762053
뭐허요? 옆집에는 주먹들이 대기허고 있습니다.,What is it fist be look in the next door,0.531201,0.703555,0.829744
장군님! 원래 등잔 밑이 뜨거운 법이랍니다. ,superior general Originally the hindquarters of the lamp cost hot,0.586986,0.561850,0.762883
알아들었을 줄 알고 목숨만은 살려주것소. ,I know youve experience it and Ill save up your living,0.557537,0.602894,0.766614
빨찌산! 약해. 한 방 더 놔. ,Suckle Weak Put one more than,0.542701,0.576329,0.741708
봤어요? 예? ,saw Yes,0.415754,0.704636,0.728702
왜 말씀이 없으세요? 화나셨어요? ,Why arent you peach Are you angry,0.438574,0.592071,0.809996
애 하나 박아논거 왜 미리 얘기 안했어? ,Why didnt you tell me how to dally a fry,0.481298,0.610455,0.769733
놀래드릴려고 했는데.. 재미있잖아요. ,I be go to storm you Its play,0.462402,0.550231,0.834069
나는 노름을 재미로 하는 사람 아냐. 고니야 그거 줘봐라. ,I am not a play gambling somebody establish it to Connie,0.526339,0.604543,0.790884
뭐요? ,what,0.396358,0.625843,0.695812
쇳덩어리. 우리 같은 사람들은 저런 거 멀리해야 된다. ,Lump citizenry like us should detain off from that,0.581675,0.675378,0.790555
고니는 가지 마. ,Dont conk,0.635877,0.751726,0.799090
죄인 옆에 있으면 같이 벼락 맞는 법이다.,If you represent next to a evildoer you will represent thunderbolt in concert,0.504149,0.586156,0.811656
누가 죄인인지 모르겠네요. ,I dont jazz who is the sinner,0.497198,0.673084,0.775991
허! 안가냐? ,Huh Arent you choke,0.618499,0.585956,0.764061
거기서 8땡이 나올 확률이 몇%냐? ,What exist the probability of 8 dots do out there,0.569589,0.673398,0.745143
6.4%죠. 1/16. ,64 116,0.000000,0.000000,0.000000
넌 글렀어. 타짜는 99%에도 배팅 안하는거야.  이걸로 손가락 하나 잘라라. ,You be writing Tajja doesnt still look on 99 baseball swing one finger with this,0.536260,0.648280,0.810236
왜요?,why,0.548993,0.585731,0.593658
약속 지켜야지. 누나 돈에 다섯배를 땄잖아. ,I own to keep my promise You compensate five time for your money,0.575630,0.609461,0.722471
..... ,,1.000000,1.000000,1.000000
기술이 아깝냐? ,engineering science is a waste material,0.475254,0.622721,0.835901
아뇨. ,no,0.200657,0.641886,0.694253
뭘 웃어? ,What comprise you express mirth at,0.272678,0.614118,0.886365
너 화투치냐? ... 내기할래? 너 그거 못 자른다.,Are you angry Would you wager You cant trim back that,0.623786,0.564585,0.751800
어차피 니 손가락은 남들이 다 알아서 잘라줄건데.. 그냥 놔둬라. 헐헐.. ,Anyway everyone will shoot caution of your digit and disregard it just now bequeath it precipitation,0.546700,0.641799,0.765973
당신 누구야? ,who are you,0.318763,0.367873,0.850353
시벌 뭔 통성명은.. ,Sigil what is it,0.524249,0.679361,0.832880
그래 시발. 인생 관뚜껑에 못박히는 소리 들어봐야 아는거야. 가자 패 뒤집히는대로.,Yes ass You feature to heed to the phone of being cop to the hat of your life Lets plow over,0.565225,0.597454,0.793233
아직 안죽고 살아있네요? ,Are you yet alive,0.471278,0.594277,0.844741
걱정마라. 언젠간 다 죽으니까. ,Dont worry Because someday its all dead,0.614808,0.640372,0.765060
손모가지 한번 잘라줘야 되는데. 오늘이 그 날인가? ,I own to issue my paw represent today that day,0.514315,0.637006,0.822365
좋은 날이 있겠지. ,There will embody a good day,0.530106,0.649551,0.770481
쫄긴.. ,Long,0.518545,0.700000,0.718082
누굽니까? ,Who cost you,0.645601,0.645548,0.730284
아귀! ,angler fish fish,0.378880,0.561247,0.846950
아귀? ,angler fish fish,0.378880,0.561247,0.846950
안잘랐나?,Didnt you issue it,0.578168,0.566796,0.767977
생각해봤는데요 에... 제가 잘할 수 있는 게 이거고.. 에.. 사나이로 태어났으면 악셀 한번 밟아봐야 되는 것 아닙니까? ,Ive be mean uh this constitute what I can do considerably uh If I equal acquit as a military personnel wouldnt it live necessary to pace on the accelerator pedal,0.562181,0.638434,0.760957
내가 왜 그 여자랑 일 안하는 지 아냐? 그 여자는 예쁜 칼이야. 조심해서 만져라. 갈수록 여자들이 무서워진다. ,dress you have intercourse why I dont work with the char The cleaning woman equal a pretty tongue tactile sensation cautiously The more and more char go scared,0.585792,0.643597,0.751932
평경장님! 나중에 뵙더라도 저 의리 꼭 지킵니다. ,Chief Pyeongkyung still if I see you later I will celebrate my righteousness,0.589411,0.636633,0.742459
이 바닥에는 영원한 친구도 적도 없다. 마지막 수칙이다! 가봐~,There constitute no eternal acquaintance on this level This represent the last linguistic rule disco biscuit,0.497519,0.609104,0.813239
제가 인생 예술로 한번 살아보겠습니다. ,I will know with art of life,0.367408,0.555292,0.856422
토탈로 해주세요. 구두랑 지갑까지. ,delight get along it in total From shoe to wallet,0.558587,0.619360,0.761580
큰거 한 장이 넘어가는데요. ,One big page is over,0.446881,0.598199,0.818015
내말 못들었어요? ,Didnt you hear me,0.448277,0.498727,0.754309
아 예.  ,Ah yes,0.784376,0.923725,0.770177
내가 운전할게. ,I will tug,0.418512,0.638225,0.821963
들어봐. 이 엔진 소리. 죽이지. 꼭 달리기 직전에 말 같애. ,listen This locomotive engine go killing it It count like a gymnastic horse just before black market,0.526060,0.696265,0.811445
한번 밟아볼까? ,Shall we step on it,0.603655,0.577874,0.733617
겨울엔 추워서 못 타겠다. ,I pitch cod it because its common cold in wintertime,0.498212,0.589233,0.826447
호호호.. ,Hohoho,0.831221,0.730612,0.801284
나 들어가고 십분 있다 들어와. ,I go in and there represent 10 minute,0.599100,0.630081,0.705384
어머 나 너무 뚱뚱해. ,Oh my im too fat,0.496465,0.611535,0.858840
원래 그렇게 말이 없어요?,Isnt that hence original,0.640252,0.632359,0.690905
네. ,Yes,0.701027,0.952860,0.589453
정마담은 안지 오래 됐나봐요?,Doesnt Jeong ma'am experience embody around for a long time,0.479334,0.616370,0.822259
누님한테 물어보십쇼. ,take your sis,0.449639,0.621658,0.882610
자 20%. 이 돈으로 뭐할거야? ,forthwith 20 What constitute you go to do with this money,0.515921,0.609823,0.777352
비밀. ,Secret,0.525747,0.701126,0.775255
oh hwa-tu? this way. ,oh hwatu this path,0.829751,0.792175,0.748421
7만 뜨면 대나? 또 7이나? 손에 쐬복이 부텄나 와이라노.  아그야 여 쟈니워커 한나 내와라. 블루 블루~ ,Can I get it if I unfold seven Another seven Wairano own go handwriting Ah come in on Johnny pedestrian Hannah blue air blue air,0.633081,0.619036,0.755304
와? 따믄 안되나? ,Wow Isnt it hot,0.709996,0.696160,0.748054
고마 하이소. 같은 기술자끼리. ,Goma Haiso The like technicians,0.644477,0.767494,0.734491
아저씨들 기술 몇 개 안되던데.,He didnt experience a few science,0.788763,0.767643,0.714508
기술자는 기술자들 봐주고 그라는긴데.. ,technician wait at technicians and order,0.548069,0.645133,0.829935
기술로 붙어봅시다. 재미있을거 같은데. ,LET lodge with engineering science auditory sensation fun,0.617669,0.642017,0.735106
재미? 와 돌아뿔겠네. 반년동안 제삿밥 맥여놨드만 으만놈이 와서 훑어가믄 우린 머 호랭이 아가리야? ,playfulness Wow Ive live reek it for half a year but a military personnel do and aim a feel What constitute we sing about,0.535435,0.611785,0.767556
먹고 땡하입시다. 우리도 식구가 열이라.  정마담한테 안부 전해주고. ,Lets rust and rust We also own a fever Say hello to Jeong Madame,0.541734,0.621476,0.804875
샤토 마고 84년입니다.,Chateau Margo cost 84 class old,0.577091,0.647625,0.773212
여기서 제일 비싼거지?,exist it the about expensive here,0.646691,0.695493,0.773558
예.  그리고 저 아가씨가 싫다는데요.,Yes And I hate that miss,0.559821,0.662252,0.852240
다시 가서 얘기해봐.  ,ecstasy backward and speak,0.534313,0.636226,0.735745
돈 앞엔 국경이 없죠. ,There constitute no edge in social movement of money,0.458009,0.583871,0.796772
What’s your job?,Whats your job,0.606512,0.740987,0.713688
뭐? 짭? 잡! 잡이라.. I am.. gambler. Korean best.,What What Job Job I am gambler Korean good,0.611079,0.647858,0.772046
nice man. ,nice man,0.529140,0.756004,0.772876
어제 거긴 왜 갔어?,Why get along you exit there yesterday,0.451706,0.670725,0.863560
어딜? ,Where cost you,0.346825,0.585692,0.789919
미군부대.,US military power,0.431574,0.525893,0.778678
귀신이구만. 심심해서. 사이즈 큰 타짜있나.. 별거 없던데. ,Its a shade By Bored Energy Department it take a large size,0.547513,0.649419,0.799738
다른 판대기는 가지마. 이 바닥은 쪽이 팔리면 취직이 안돼. 취직 안되면 타짜 인생 끝나는거야. ,Dont give out to other instrument panel If the trading floor live sell you pitch induce a chore If you dont beat a chore your life is over,0.629042,0.629042,0.746888
저걸로 입어. 고니는 퍼플이 어울려. 오늘 대머리때메 판대기가 커질거야. ,couch on that Connie represent purple today baldness will ca-ca the shell big,0.584338,0.687377,0.785363
교수가 웬 돈이 그렇게 많대? ,How much money arrange the professor experience,0.514500,0.648074,0.752207
애 병원비래. ,Its the hospital hospital,0.614036,0.571306,0.835597
뭐해요? 교수님! ,What be you come professor,0.627715,0.579179,0.766166
결과를 봅시다. ,LET go out the issue,0.590466,0.693880,0.777436
별로 안높아요. 8끗. ,Its not real high 8 clean,0.567071,0.694837,0.817601
후~ 또 한끗 차이네. ,Whoo Its a divergence,0.661352,0.706997,0.726936
교수님! 옆방 가서 커피 한잔 하나 드시고 오세요. 흐름도 그런데. ,professor tour to the next elbow room and have got a loving cup of chocolate menstruation chart by the way,0.517071,0.593815,0.748796
그럴까..,I question,0.611253,0.642613,0.702747
힘내 오빠! 딸라고 잃는 거야. ,rotter crony Im losing my daughter,0.521135,0.598168,0.742314
처칠이.. 너 처칠 노벨문학상 받은 거 아냐? 그 처칠이 2차대전이 끝날 때,Winston Churchill Didnt you set out the Churchill Nobel pillage for Literature When Churchill end Earth warfare two,0.627094,0.612848,0.765817
그럼 지금 자지끝이 빠짝빠짝 타겠다. 내 거 만져. 이런거 만지면 딴대잖아. ,and so Im choke to cod my cock continuously tactile sensation mine Its unlike if you stir this,0.635162,0.647766,0.758991
좋아!  좋아! ,Good Good,0.455848,0.455848,0.822263
얼마 남았어요? 다 밀어 늡시다. ,How much is will net ball crusade it all,0.593648,0.592134,0.708236
일억쯤 되는데.. 까봅시다. ,Its about 100 million Lets check,0.634758,0.713332,0.738727
4땡. ,4 ding,0.486628,0.771418,0.816141
잘 놀았습니다. ,I dally good,0.438637,0.719373,0.790591
아저씨! 뽀찌 받아가야지. ,Mister I experience to cull it up,0.482869,0.567968,0.779482
이렇게 많이? ,and so much,0.697563,0.733017,0.631777
교수님! 다시 화투판에 나타나면 나한테 죽습니다. ,professor When I appear again on the field I conk,0.445956,0.558070,0.794528
예. 고맙습니다. ,Yes thank you,0.467468,0.663479,0.785697
많이 따세요. ,pluck a circumstances,0.513204,0.646009,0.778626
지금 저사람 아무도 못막아. 알잖아. 고니도 그랬고 나도 그랬고. ,No I can turn back him now You sleep together indeed did Connie and so did I,0.557710,0.624336,0.783034
정마담도 저런때가 있었어?,Did Jeong Madame always stimulate that,0.613237,0.678689,0.760937
왜 없었겠어. ,Why not,0.494855,0.667217,0.806069
고니 찾는데! ,count for Connie,0.730962,0.707527,0.712209
나?  여보세요... 네  왜 저한테? ....  죽었다구요? 지금 가면 확인할 수 있습니까? ,I Hello why me conk ass I check it out today,0.441269,0.657040,0.888599
너 이새끼. ,You squawk,0.655754,0.655754,0.708321
며칠째 이러고만 있을거야? ,What days are you go to be act this,0.670570,0.688254,0.755441
내가 그때 같이 갔어야 되는데. ,I should experience represent there so,0.674366,0.625103,0.727833
내일부터 창고로 출근해. ,I die to go from tomorrow,0.499988,0.529724,0.802409
술깨면.,If you pledge,0.587270,0.676766,0.759697
괜찮아? 아우~ 나 진짜 걱정 많이 했다. 인간적인 감정으로. ,OK Buckeye State I represent rattling worried With human emotion,0.567539,0.563926,0.780125
누가 평경장님을 죽였는지 알았어. ,I knew who down senior pilot Pyeong,0.468464,0.624519,0.840922
.. 누가?,Who,0.452156,0.431331,0.682873
아귀!,angler fish fish,0.378880,0.561247,0.846950
아귀? ,angler fish fish,0.378880,0.561247,0.846950
아귀랑 한 판 붙여줘. ,Please arrange a photographic plate with the angler,0.457639,0.556098,0.809396
안돼. 아귀랑 치면 다 죽어. ,No If you attain it youre all dead,0.602954,0.594574,0.792149
